"Wegmans,  Wegmans Food Markets  Inc.","wegmans,wegmans-food-markets-inc",10.0,0.017,N77890387665,usda-ndb-import,salsa con queso,490.0,6.67,0.0,0,,Wegmans Salsa Con Queso Dip,3.33,30 g (2 Tbsp),0.5,3.33
"Jimmy Dean,  Sara Lee Foods","jimmy-dean,sara-lee-foods",26.15,0.031,N77900650321,usda-ndb-import,smoked turkey breast,933.0,6.92,2.3,0,,"Jimmy Dean Delights, Hickory Smoked Turkey Breast",16.15,130 g (2 SANDWICHES),0.623,3.85
"Snyder's Of Hanover,  Snyder's-Lance  Inc.","snyder-s-of-hanover,snyder-s-lance-inc",75.0,0.0,N77975081006,usda-ndb-import,yellow corn tortilla,2092.0,17.86,7.1,0,,Snyder's Of Hanover Yellow Corn Tortilla Chips,7.14,28 g (13 CHIPS | ABOUT),0.48200000000000004,0.0
Snyder's Of Hanover,snyder-s-of-hanover,75.0,0.0,N77975091784,usda-ndb-import,yellow corn tortilla,2092.0,17.86,7.1,0,,Snyder's Of Hanover Yellow Corn Tortilla Chips,7.14,28 g (1 oz),0.48200000000000004,0.0
Madhava,madhava,75.0,0.0,N78314251050,usda-ndb-import,chocolate chip cookie,1569.0,6.25,0.0,0,,Madhava Deliciously Organic Mmm...Chocolate Chip Cookie Mix,6.25,16 g (16 g),0.43799999999999994,43.75
The Greek Gods,the-greek-gods,14.54,0.022000000000000002,N78355570103,usda-ndb-import,greek style yogurt,536.0,6.17,0.0,0,,"The Greek Gods Greek Style Yogurt, Honey, Vanilla",3.52,227 g (1 cup),0.059000000000000004,14.54
"The Greek Gods,  Hain Refrigerated Foods Inc.","the-greek-gods,hain-refrigerated-foods-inc",14.54,0.022000000000000002,N78355570264,usda-ndb-import,greek style yogurt,536.0,6.17,0.0,0,,"The Greek Gods Greek Style Yogurt, Black Cherry",3.52,227 g (1 cup),0.062,14.54
Great Value,great-value,45.65,0.0,N78742007991,usda-ndb-import,hot dog buns,1000.0,4.35,6.5,0,,Great Value Whole Wheat Hot Dog Buns,10.87,46 g (1 BUN),0.37,4.35
Great Value,great-value,0.0,0.05,N78742010540,usda-ndb-import,salsa con queso,837.0,20.0,0.0,0,,Great Value Cheese Dip Salsa Con Queso,10.0,30 g (2 Tbsp),1.133,0.0
Great Value,great-value,7.2,0.004,N78742020808,usda-ndb-import,chicken condensed soup,201.0,1.6,0.8,0,,Great Value Cream Of Chicken Condensed Soup,1.6,125 g (0.5 cup),0.32799999999999996,0.0
Wal-Mart Stores  Inc.,wal-mart-stores-inc,67.86,0.0,N78742025537,usda-ndb-import,yellow corn tortilla,2092.0,21.43,7.1,0,,Wal-Mart Stores  Inc. Stadium Style Yellow Corn Tortilla Chips,7.14,28 g (9 CHIPS | ABOUT),0.39299999999999996,0.0
Great Value,great-value,63.33,0.0,N78742034140,usda-ndb-import,baked snack crackers,2092.0,26.67,3.3,0,,Great Value Baked Snack Crackers,10.0,30 g (25 CRACKERS),0.7,0.0
Great Value,great-value,79.17,0.0,N78742059716,usda-ndb-import,chewy granola bars,1569.0,6.25,4.2,0,,Great Value 90 Calorie Chewy Granola Bars,4.17,24 g (24 g),0.20800000000000002,29.17
The Bakery Baked With Pride,the-bakery-baked-with-pride,67.65,0.028999999999999998,N78742069272,usda-ndb-import,chocolate chunk cookies,1971.0,17.65,2.9,0,,The Bakery Baked With Pride Chocolate Chunk Cookies,2.94,34 g (1 COOKIE),0.33799999999999997,41.18
Great Value,great-value,57.14,0.0,N78742074993,usda-ndb-import,chewy granola bars,2033.0,22.86,2.9,0,,"Great Value Chewy Granola Bars, Almond",8.57,35 g (35 g),0.4,28.57
"Daily Chef,  Wal-Mart Stores  Inc.","daily-chef,wal-mart-stores-inc",64.1,0.013000000000000001,N78742081373,usda-ndb-import,peanut butter cups,2146.0,28.21,2.6,0,,"Daily Chef Mini Peanut Butter Cups, Milk Chocolate",5.13,39 g (26 PIECES),0.115,58.97
Great Value,great-value,0.0,0.045,N78742082752,usda-ndb-import,chunk light tuna,372.0,0.0,0.0,0,,Great Value Chunk Light Tuna In Water,19.64,56 g (2 oz),0.321,0.0
"Great Value,  Wal-Mart Stores  Inc.","great-value,wal-mart-stores-inc",75.86,0.0,N78742085593,usda-ndb-import,baked snack crackers,1732.0,10.34,10.3,0,,Great Value Thin Wheat Baked Snack Crackers,6.9,29 g (16 CRACKERS),0.621,17.24
"The Bakery Baked With Pride,  Wal-Mart Stores  Inc.","the-bakery-baked-with-pride,wal-mart-stores-inc",58.54,0.073,N78742096957,usda-ndb-import,soft baked cookies,1837.0,21.95,0.0,0,,"The Bakery Baked With Pride Soft Baked Cookies, Confetti",4.88,41 g (1 COOKIE),0.317,24.39
"Great Value,  Wal-Mart Stores  Inc.","great-value,wal-mart-stores-inc",64.29,0.0,N78742105246,usda-ndb-import,popcorn white cheddar,1941.0,17.86,10.7,0,,"Great Value Flavored Popcorn, White Cheddar",10.71,28 g (3.5 cup),0.893,3.57
"Daily Chef,  Wal-Mart Stores  Inc.","daily-chef,wal-mart-stores-inc",62.5,0.031,N78742107790,usda-ndb-import,chocolate chunk cookies,2092.0,25.0,6.2,0,,Daily Chef Chocolate Chunk Cookies,6.25,16 g (1 COOKIE),0.312,37.5
Great Value,great-value,64.29,0.0,N78742114538,usda-ndb-import,white corn tortilla,2092.0,21.43,3.6,0,,Great Value Restaurant Style White Corn Tortilla Chips,7.14,28 g (1 oz),0.429,0.0
"Great Value,  Wal-Mart Stores  Inc.","great-value,wal-mart-stores-inc",64.29,0.0,N78742122564,usda-ndb-import,potato chips cheddar,2092.0,25.0,3.6,0,,"Great Value Potato Chips, Cheddar Horseradish",7.14,28 g (15 CHIPS) | (ABOUT),0.643,7.14
Great Value,great-value,18.18,0.068,N78742127033,usda-ndb-import,whipped cream cheese,1142.0,18.18,0.0,0,,Great Value Whipped Cream Cheese Spread,4.55,22 g (2 Tbsp),0.295,18.18
"The Bakery,  Wal-Mart Stores  Inc.","the-bakery,wal-mart-stores-inc",65.79,0.026000000000000002,N78742132761,usda-ndb-import,frosted sugar cookies,1761.0,15.79,0.0,0,,The Bakery Frosted Sugar Cookies,2.63,38 g (1 COOKIE),0.276,42.11
"The Bakery Baked With Pride,  Wal-Mart Stores  Inc.","the-bakery-baked-with-pride,wal-mart-stores-inc",65.79,0.026000000000000002,N78742132785,usda-ndb-import,frosted sugar cookies,1761.0,15.79,0.0,0,,The Bakery Baked With Pride Frosted Sugar Cookies,2.63,38 g (1 COOKIE),0.276,42.11
Great Value,great-value,53.57,0.0,N78742200125,usda-ndb-import,wavy potato chips,2389.0,35.71,3.6,0,,Great Value Wavy Potato Chips,7.14,28 g (22 CHIPS | ABOUT),0.5,3.57
Great Value,great-value,7.32,0.004,N78742229010,usda-ndb-import,chicken condensed soup,205.0,1.63,0.0,0,,Great Value Cream Of Chicken Condensed Soup,1.63,123 g (0.5 cup),0.61,0.81
Wal-Mart Stores  Inc.,wal-mart-stores-inc,54.55,0.0,N78742230276,usda-ndb-import,cinnamon rolls with,1331.0,7.95,2.3,0,,Wal-Mart Stores  Inc. Reduced Fat Cinnamon Rolls With Icing,4.55,44 g (1 ROLL WITH ICING),0.727,22.73
Great Value,great-value,8.13,0.004,N78742371597,usda-ndb-import,chicken condensed soup,372.0,5.69,0.0,0,,Great Value Cream Of Chicken Condensed Soup,1.63,123 g (0.5 cup),0.7070000000000001,0.81
Great Value,great-value,8.13,0.0,N78742371603,usda-ndb-import,mushroom condensed soup,339.0,4.88,0.0,0,,Great Value Cream Of Mushroom Condensed Soup,0.81,123 g (0.5 cup),0.7070000000000001,0.81
Wal-Mart Stores  Inc.,wal-mart-stores-inc,52.53,0.0,N78742433974,usda-ndb-import,cinnamon rolls with,1351.0,10.1,1.0,0,,Wal-Mart Stores  Inc. Jumbo Cinnamon Rolls With Icing,4.04,99 g (1 ROLL WITH ICING),0.687,24.24
La Sierra,la-sierra,13.04,0.0,N78883240219,usda-ndb-import,refried black beans,510.0,6.09,3.5,0,,La Sierra Refried Black Beans,3.48,115 g (0.5 cup),0.348,0.87
Tribe Mediterranean Foods  Inc.,tribe-mediterranean-foods-inc,17.86,0.0,N78902411163,usda-ndb-import,red pepper hummus,749.0,10.71,3.6,0,,"Tribe Mediterranean Foods  Inc. Tribe, Swirl Sweet Red Pepper Hummus",3.57,28 g (2 TBSP),0.5,3.57
Awrey's,awrey-s,88.89,0.011000000000000001,N79729100575,usda-ndb-import,pancake waffle mix,1858.0,4.44,4.4,0,,Awrey's Pancake & Waffle Mix,11.11,45 g (0.375 cup),0.778,6.67
Open Nature,open-nature,3.57,0.045,N79893106205,usda-ndb-import,roasted turkey breast,448.0,1.79,0.0,0,,Open Nature 100% Natural Oven Roasted Turkey Breast,17.86,56 g (2 oz),0.9109999999999999,1.79
Open Nature,open-nature,17.86,0.0,N79893110202,usda-ndb-import,red pepper hummus,1197.0,21.43,3.6,0,,Open Nature Roasted Red Pepper Hummus,7.14,28 g (1 oz),0.536,3.57
Open Nature,open-nature,21.05,0.036000000000000004,N79893111087,usda-ndb-import,thin crust pizza,1017.0,12.5,2.0,0,,Open Nature Supreme Multi-Grain Ultra Thin Crust Pizza,12.5,152 g (1 PIZZA),0.638,3.95
O Organics,o-organics,12.63,0.02,N79893336855,usda-ndb-import,salad with chicken,699.0,10.1,2.0,0,,O Organics Organic Apple Walnut Salad With Chicken,8.08,198 g (1 CONTAINER),0.273,8.08
Glencourt Inc.,glencourt-inc,0.0,0.045,N79893356242,usda-ndb-import,chunk white albacore,448.0,0.0,0.0,0,,Glencourt Inc. Chunk White Albacore Tuna In Water,26.79,56 g (56 GRM),0.321,0.0
Breast O' Chicken,breast-o-chicken,3.57,0.036000000000000004,N80000005984,usda-ndb-import,chunk light tuna,674.0,8.04,3.6,0,,Breast O' Chicken Chunk Light Tuna In Vegetable Oil,17.86,56 g (2 oz),0.33899999999999997,0.0
Starkist,starkist,0.0,0.054000000000000006,N80000016508,usda-ndb-import,chunk light tuna,448.0,0.89,0.0,0,,Starkist Chunk Light Tuna In Water,23.21,56 g (2 oz),0.46399999999999997,
Starkist,starkist,14.62,0.031,N80000484482,usda-ndb-import,chunk light tuna,707.0,6.15,1.5,0,,"Starkist Charlie's Lunch Kit, Chunk Light Tuna Salad In Water",15.38,130 g (4.5 oz),0.446,3.46
Starkist,starkist,17.24,0.026000000000000002,N80000495426,usda-ndb-import,albacore tuna in,866.0,7.76,0.9,0,,"Starkist Lunch To-Go, Albacore Tuna In Water",15.52,116 g (116 g),0.509,6.9
Starkist,starkist,0.0,0.036000000000000004,N80000495648,usda-ndb-import,chunk light tuna,335.0,0.89,,0,,Starkist Chunk Light Tuna,17.86,56 g (2 oz),0.321,
Starkist,starkist,0.0,0.036000000000000004,N80000495693,usda-ndb-import,albacore tuna in,372.0,0.89,0.0,0,,Starkist Solid White Albacore Tuna In Water,21.43,56 g (2 oz),0.33899999999999997,
Starkist,starkist,13.22,0.025,N80000516947,usda-ndb-import,chunk white albacore,690.0,4.96,1.2,0,,"Starkist Charlie's Lunch Kit, Chunk White Albacore Tuna In Water",14.88,121 g (4.28 oz),0.397,3.72
Diamond Foods  Inc.,diamond-foods-inc,52.5,0.0,N84114113658,usda-ndb-import,sweet potato chips,2301.0,37.5,10.0,0,,Diamond Foods  Inc. Sweet Potato Chips,5.0,40 g (40 GRM),0.525,22.5
Kettle,kettle,57.14,0.0,N84114900050,usda-ndb-import,sweet potato chips,2243.0,35.71,7.1,0,,Kettle Sweet Potato Chips,3.57,28 g (13 CHIPS) | (ABOUT),0.536,25.0
Rice Dream,rice-dream,33.33,0.0,N84253128841,usda-ndb-import,dairy frozen dessert,791.0,6.67,0.0,0,,"Rice Dream Organic Non-Dairy Frozen Dessert, Strawberry",0.0,90 g (0.5 cup),0.094,17.78
"Two-Bite,  Sourdough:  A European Bakery","two-bite,sourdough-a-european-bakery",66.67,0.017,N84617600020,usda-ndb-import,oatmeal raisin cookies,1674.0,11.67,3.3,0,,Two-Bite Soft Baked Oatmeal Raisin Cookies,6.67,30 g (3 COOKIES),0.2,40.0
Target Stores,target-stores,39.47,0.0,N85239000083,usda-ndb-import,dark chocolate almonds,2314.0,44.74,10.5,0,,Target Stores Dark Chocolate Almonds,10.53,38 g (0.25 cup),0.0,23.68
Target Stores,target-stores,52.27,0.0,N85239000854,usda-ndb-import,cinnamon rolls with,1427.0,11.36,2.3,0,,Target Stores Cinnamon Rolls With Icing,4.55,44 g (1 ROLL WITH ICING),0.682,25.0
"Simply Balanced,  Target Stores","simply-balanced,target-stores",13.85,0.0,N85239002698,usda-ndb-import,refried black beans,322.0,0.77,3.1,0,,Simply Balanced Organic Refried Black Beans,3.85,130 g (0.5 cup),0.392,0.77
Target Stores,target-stores,35.71,0.0,N85239004449,usda-ndb-import,whole grain bread,895.0,0.0,7.1,0,,Target Stores Whole Grain Bread,10.71,28 g (1 SLICE),0.321,0.0
"Market Pantry,  Target Stores","market-pantry,target-stores",60.71,0.018000000000000002,N85239013304,usda-ndb-import,red velvet cake,1795.0,17.86,0.0,0,,Market Pantry Red Velvet Cake Bites,3.57,28 g (2 COOKIES),0.179,39.29
Target Stores,target-stores,1.79,0.054000000000000006,N85239013434,usda-ndb-import,smoked turkey breast,372.0,0.0,,0,,Target Stores Hickory Smoked Turkey Breast,19.64,56 g (2 ONZ),0.643,
Target Stores,target-stores,70.0,0.012,N85239040867,usda-ndb-import,chocolate covered pretzels,1987.0,20.0,2.5,0,,Target Stores Chocolate-Covered Pretzels,7.5,40 g (11 PRETZELS),0.7,32.5
Target Brands  Inc.,target-brands-inc,67.86,0.0,N85239062722,usda-ndb-import,white corn tortilla,2092.0,25.0,7.1,0,,Target Brands  Inc. White Corn Tortilla Chips Black Bean With Flaxseed,7.14,28 g (1 oz),0.321,0.0
Target Stores,target-stores,42.5,0.0,N85239080573,usda-ndb-import,dark chocolate almonds,2301.0,42.5,10.0,0,,Target Stores Dark Chocolate Almonds,10.0,40 g (0.25 cup),0.0,30.0
Market Pantry,market-pantry,75.86,0.0,N85239108536,usda-ndb-import,baked snack crackers,1874.0,12.07,6.9,0,,Market Pantry Baked Snack Crackers,6.9,29 g (29 g),0.7929999999999999,13.79
Market Pantry,market-pantry,25.0,0.075,N85239140154,usda-ndb-import,whipped cream cheese,1464.0,25.0,0.0,0,,Market Pantry Brown Sugar Cinnamon Whipped Cream Cheese Spread,5.0,20 g (2 Tbsp),0.4,15.0
Target Brands  Inc.,target-brands-inc,70.83,0.0,N85239145203,usda-ndb-import,chewy granola bars,1745.0,10.42,4.2,0,,Target Brands  Inc. Chewy Granola Bars,8.33,24 g (24 g),0.146,29.17
"Market Pantry,  Target Stores","market-pantry,target-stores",8.13,0.0,N85239180648,usda-ndb-import,mushroom condensed soup,205.0,1.63,0.0,0,,Market Pantry Cream Of Mushroom Condensed Soup,0.81,123 g (0.5 cup),0.33299999999999996,1.63
"Market Pantry,  Target Stores","market-pantry,target-stores",7.32,0.0,N85239185490,usda-ndb-import,mushroom condensed soup,305.0,4.88,0.0,0,,Market Pantry Cream Of Mushroom Condensed Soup,1.63,123 g (0.5 cup),0.6829999999999999,0.81
Archer Farms,archer-farms,6.45,0.016,N85239260302,usda-ndb-import,salsa con queso,473.0,8.06,0.0,0,,Archer Farms Salsa Con Queso,3.23,31 g (2 Tbsp),0.645,0.0
Target Stores,target-stores,7.06,0.11199999999999999,N85239342213,usda-ndb-import,italian style meatballs,1427.0,25.88,0.0,0,,Target Stores Italian-Style Meatballs,20.0,85 g (3 MEATBALLS),0.494,1.18
"Simply Balanced,  Target Stores","simply-balanced,target-stores",7.2,0.0,N85239404720,usda-ndb-import,organic pasta sauce,201.0,1.6,0.8,0,,"Simply Balanced Organic Pasta Sauce, Parmesan",2.4,125 g (0.5 cup),0.392,4.8
"Simply Balanced,  Target Stores","simply-balanced,target-stores",67.86,0.0,N85239610909,usda-ndb-import,yellow corn tortilla,2092.0,25.0,3.6,0,,Simply Balanced Organic Yellow Corn Tortilla Chips,7.14,28 g (11 CHIPS),0.28600000000000003,0.0
Market Pantry,market-pantry,25.76,0.045,N85239731000,usda-ndb-import,chocolate ice cream,950.0,10.61,0.0,0,,Market Pantry Chocolate Ice Cream,4.55,66 g (0.5 cup),0.083,22.73
Simply Balanced,simply-balanced,75.0,0.0,N85239792209,usda-ndb-import,chewy granola bars,1569.0,6.25,4.2,0,,"Simply Balanced Chewy Granola Bars, Apple Berry",4.17,24 g (1 BAR),0.062,33.33
"Clover Valley,  Abimar Foods  Inc.","clover-valley,abimar-foods-inc",65.71,0.0,N86106031025,usda-ndb-import,cookies peanut butter,1795.0,17.14,0.0,0,,"Clover Valley Sandwich Creme Cookies, Peanut Butter",5.71,35 g (3 COOKIES),0.18600000000000003,31.43
"Bumble Bee,  Bumble Bee Foods  Llc","bumble-bee,bumble-bee-foods-llc",0.0,0.054000000000000006,N86600000251,usda-ndb-import,chunk white albacore,448.0,1.79,0.0,0,,"Bumble Bee Premium Tuna In Water, Chunk White Albacore",23.21,56 g (0.25 CUP) | DRAINED (ABOUT),0.25,0.0
Bumble Bee,bumble-bee,0.0,0.054000000000000006,N86600007373,usda-ndb-import,chunk white albacore,448.0,1.79,0.0,0,,Bumble Bee Chunk White Albacore In Water,23.21,56 g (2 oz),0.25,0.0
"Bumble Bee,  Bumble Bee Foods  Llc","bumble-bee,bumble-bee-foods-llc",0.0,0.045,N86600250540,usda-ndb-import,albacore tuna in,523.0,0.89,0.0,0,,"Bumble Bee Prime Fillet, Solid White Albacore Tuna In Water",28.57,56 g (0.25 CUP) PER CAN | DRAINED (ABOUT),0.25,0.0
Bumble Bee Foods  Llc,bumble-bee-foods-llc,0.0,0.054000000000000006,N86600260105,usda-ndb-import,albacore tuna in,674.0,7.14,,0,,"Bumble Bee Foods  Llc Wild Selections, Solid White Albacore Tuna In Water, No Salt Added",25.0,56 g (2 oz),0.134,
Ingles Markets Inc.,ingles-markets-inc,29.85,0.045,N86854031087,usda-ndb-import,premium ice cream,937.0,10.45,0.0,0,,"Ingles Markets Inc. Ingles Best, Premium Ice Cream, French Vanilla",4.48,67 g (0.5 cup),0.11900000000000001,25.37
Ingles Markets Inc.,ingles-markets-inc,67.86,0.0,N86854062937,usda-ndb-import,white corn tortilla,2092.0,21.43,7.1,0,,Ingles Markets Inc. Dipz White Corn Tortilla Chips,7.14,28 g (7 CHIPS | ABOUT),0.39299999999999996,0.0
Midamar Corporation,midamar-corporation,14.12,0.047,N87919030601,usda-ndb-import,chicken breast nuggets,1134.0,16.47,1.2,0,,Midamar Corporation Chicken Breast Nuggets,16.47,85 g (4 NUGGETS),0.506,0.0
Ducal,ducal,13.85,0.0,N88313062946,usda-ndb-import,refried black beans,611.0,7.69,6.9,0,,Ducal Refried Black Beans,5.38,130 g (0.5 cup),0.315,0.77
Malher,malher,21.15,0.0,N89674085438,usda-ndb-import,refried black beans,615.0,3.85,5.8,0,,"Malher Refried Black Beans, Chiles Jalapenos",6.41,156 g (0.5 cup),0.41,
La Campera,la-campera,49.21,0.0,N89851160231,usda-ndb-import,yellow corn tortilla,996.0,2.38,4.8,0,,La Campera Yellow Corn Tortilla Para Tacos,6.35,63 g (3 TORTILLAS),0.008,0.0
Fenton Enterprises  Inc.,fenton-enterprises-inc,67.86,0.004,N90272002024,usda-ndb-import,chocolate covered pretzels,2004.0,21.43,3.6,0,,"Fenton Enterprises  Inc. Kara Chocolates, Chocolate Covered Pretzels Pods",7.14,28 g (1 ONZ),0.718,28.57
Trader Joe's,trader-joe-s,53.57,0.0,N916288,usda-ndb-import,white corn tortilla,2092.0,25.0,7.1,0,,Trader Joe's Unsalted Organic White Corn Tortilla Chips,7.14,28 g (1 oz),0.0,0.0
"Brookshire's,  Brookshire Grocery Company","brookshire-s,brookshire-grocery-company",53.57,0.0,N92825093053,usda-ndb-import,wavy potato chips,2389.0,39.29,3.6,0,,"Brookshire's Wavy Potato Chips, Original",3.57,28 g (22 CHIPS) | (ABOUT),0.48200000000000004,3.57
"Brookshire's,  Brookshire Grocery Company","brookshire-s,brookshire-grocery-company",62.5,0.0,N92825106968,usda-ndb-import,cookies chocolate chip,2092.0,28.12,3.1,0,,"Brookshire's Chunky Cookies, Chocolate Chip",3.12,32 g (2 COOKIES),0.344,31.25
Brookshire's,brookshire-s,9.32,0.034,N92825109570,usda-ndb-import,corned beef hash,674.0,10.17,0.8,0,,Brookshire's Corned Beef Hash,7.63,236 g (1 cup),0.424,0.42
Brookshire's,brookshire-s,18.75,0.0,N92825111597,usda-ndb-import,crunchy peanut butter,2615.0,50.0,6.2,0,,Brookshire's Crunchy Peanut Butter,21.88,32 g (2 Tbsp),0.375,9.38
Arla,arla,3.33,0.067,N93936035789,usda-ndb-import,cream cheese spread,975.0,23.33,0.0,0,,"Arla Cream Cheese Spread, Herbs & Spices",6.67,30 g (2 Tbsp),0.5329999999999999,3.33
Saba,saba,3.57,0.08,N96785013229,usda-ndb-import,tomato sauce with,335.0,3.57,0.0,0,,Saba Sardines In Tomato Sauce With Chili,10.71,56 g (0.25 cup),0.607,0.0
Pacific Coast Selections,pacific-coast-selections,7.73,0.025,N98487201409,usda-ndb-import,salad with chicken,703.0,12.27,1.4,0,,Pacific Coast Selections Caesar Salad With Chicken,8.18,220 g (1 SALAD),0.48200000000000004,1.36
Save Mart Supermarkets Inc.,save-mart-supermarkets-inc,57.14,0.0,N98487300027,usda-ndb-import,potato chips cheddar,2243.0,32.14,3.6,0,,"Save Mart Supermarkets Inc. Market Essentials, Ripple Potato Chips, Cheddar & Sour Cream",7.14,28 g (13 CHIPS),0.7859999999999999,3.57
Market Essentials,market-essentials,60.71,0.0,N98487300102,usda-ndb-import,wavy potato chips,2243.0,32.14,3.6,0,,Market Essentials Wavy Potato Chips,7.14,28 g (13 CHIPS),0.46399999999999997,3.57
Save Mart Supermarkets Inc.,save-mart-supermarkets-inc,67.86,0.0,N98487300133,usda-ndb-import,yellow corn tortilla,2092.0,25.0,3.6,0,,"Save Mart Supermarkets Inc. Market Essentials, Yellow Corn Tortilla Chips",7.14,28 g (10 CHIPS),0.375,0.0
Market Essentials,market-essentials,13.33,0.033,N98487301703,usda-ndb-import,thousand island dressing,1674.0,40.0,0.0,0,,Market Essentials Thousand Island Dressing,0.0,30 ml (2 Tbsp),0.9,13.33
365 Organic Value,365-organic-value,7.96,0.0,N99482406493,usda-ndb-import,organic pasta sauce,259.0,3.54,1.8,0,,"365 Organic Value Organic Pasta Sauce, Classic",0.88,113 g (0.5 cup),0.442,2.65
"365 Everyday Value,  Whole Foods Market  Inc.","365-everyday-value,whole-foods-market-inc",72.5,0.0,N99482424510,usda-ndb-import,pancake waffle mix,1464.0,1.25,2.5,0,,"365 Everyday Value Organic Pancake & Waffle Mix, Buttermilk",10.0,40 g (4 -INCH PANCAKES | TWO),0.7,5.0
365 Everyday Value,365-everyday-value,72.73,0.023,N99482430887,usda-ndb-import,instant mashed potatoes,1523.0,4.55,4.5,0,,365 Everyday Value Instant Mashed Potatoes,9.09,22 g (0.25 cup),1.364,0.0
"365 Everyday Value,  Whole Foods Market Ip  Lp","365-everyday-value,whole-foods-market-ip-lp",67.5,0.0,N99482431037,usda-ndb-import,steel cut oats,1569.0,6.25,10.0,0,,365 Everyday Value Organic Steel Cut Oats,12.5,40 g (0.25 cup),0.0,2.5
365 Everyday Value,365-everyday-value,71.43,0.0,N99482435523,usda-ndb-import,yellow corn tortilla,1941.0,16.07,7.1,0,,365 Everyday Value Yellow Corn Tortilla Strips,7.14,28 g (1 oz),0.161,0.0
365 Everyday Value,365-everyday-value,48.84,0.0,N99482439194,usda-ndb-import,dark chocolate bar,2431.0,41.86,7.0,0,,365 Everyday Value Organic Dark Chocolate Bar,6.98,43 g (0.5 BAR),0.0,41.86
"365 Everyday Value,  Whole Foods Market Ip Lp","365-everyday-value,whole-foods-market-ip-lp",6.12,0.006,N0099482442675,usda-ndb-import,chicken noodle soup,172.0,0.41,0.4,0,,365 Everyday Value Thai-Style Chicken Noodle Soup,2.86,245 g (1 cup),0.282,0.41
"Engine 2,  Whole Foods Market  Inc.","engine-2,whole-foods-market-inc",10.71,0.0,N0099482443542,usda-ndb-import,red pepper hummus,372.0,3.57,3.6,0,,"Engine 2 Plant-Strong, Roasted Red Pepper Hummus",3.57,28 g (2 Tbsp),0.14300000000000002,3.57
"365 Everyday Value,  Whole Foods Market  Inc.","365-everyday-value,whole-foods-market-inc",44.0,0.0,N0099482455965,usda-ndb-import,hot dog buns,1004.0,4.0,6.0,0,,365 Everyday Value Whole Wheat Hot Dog Buns,10.0,50 g (1 BUN),0.42,4.0
"365 Everyday Value,  Whole Foods Market  Inc.","365-everyday-value,whole-foods-market-inc",67.69,0.0,N0099482461133,usda-ndb-import,greek style yogurt,1611.0,4.62,7.7,0,,"365 Everyday Value Strawberry Greek Style Yogurt, Instant Oatmeal",16.92,65 g (1 cup),0.10800000000000001,21.54
Spartan,spartan,57.14,0.0,N01121302733,usda-ndb-import,wavy potato chips,2389.0,35.71,3.6,0,,Spartan Wavy Potato Chips,7.14,28 g (12 CHIPS) | (ABOUT),1.036,3.57
Western Family Foods  Inc.,western-family-foods-inc,24.71,0.0,N015400892690,usda-ndb-import,french fried potatoes,590.0,3.53,2.4,0,,Western Family Foods  Inc. Steak Cut French Fried Potatoes,2.35,85 g (3 ONZ),0.306,0.0
Melzy Creations,melzy-creations,62.5,0.0,N0182280000083,usda-ndb-import,dark chocolate bar,1464.0,12.5,22.5,0,,Melzy Creations Dark Chocolate Bar,10.0,40 g (1.41 oz),0.28800000000000003,27.5
"Pillsbury,  Anheuser-Busch Inbev","pillsbury,anheuser-busch-inbev",52.27,0.0,N01850107,usda-ndb-import,cinnamon rolls with,1331.0,10.23,2.3,0,,"Pillsbury Cinnamon Rolls, With Icing, Made With Cinnabon Cinnamon",4.55,44 g (1 ROLL WITH ICING),0.795,20.45
Shop Rite,shop-rite,0.0,0.062,N0201579810476,usda-ndb-import,sweet italian sausage,1096.0,20.0,0.0,0,,Shop Rite Sweet Italian Sausage,18.46,65 g (2.3 oz),0.785,0.0
Lupo's,lupo-s,1.79,0.076,N0201758107199,usda-ndb-import,hot italian sausage,598.0,8.04,0.9,0,,Lupo's Lean Hot Italian Sausage Chicken Patties,16.07,112 g (4 oz),0.679,0.0
Winn-Dixie,winn-dixie,0.0,0.036000000000000004,N02114000122,usda-ndb-import,albacore tuna in,448.0,1.79,0.0,0,,Winn-Dixie Solid White Albacore Tuna In Water,23.21,56 g (0.25 CUP) | (ABOUT),0.25,0.0
Cream Of Wheat,cream-of-wheat,80.0,0.0,N0213162061530,usda-ndb-import,instant hot cereal,1552.0,0.0,2.9,0,,"Cream Of Wheat Instant Hot Cereal, Maple Brown Sugar",5.71,35 g (35 g),0.4,37.14
Philadelphia,philadelphia,6.45,0.065,N02179704,usda-ndb-import,cream cheese spread,1079.0,22.58,0.0,0,,Philadelphia Original Cream Cheese Spread,6.45,31 g (2 Tbsp),0.40299999999999997,3.23
Giant Eagle,giant-eagle,7.14,0.045,N3003408742,usda-ndb-import,smoked turkey breast,523.0,1.79,0.0,0,,Giant Eagle Smoked Turkey Breast,17.86,56 g (2 SLICES),0.821,1.79
"Maruchan,  Utz Quality Foods  Inc.","maruchan,utz-quality-foods-inc",60.94,0.0,N41789001490,usda-ndb-import,noodles with vegetables,1895.0,18.75,4.7,0,,"Maruchan Instant Lunch Ramen Noodles With Vegetables, Chicken Tortilla",10.94,64 g (1 CONTAINER),2.0,4.69
Raley's,raley-s,78.26,0.0,N4656702651,usda-ndb-import,instant mashed potatoes,1456.0,0.0,4.4,0,,Raley's Instant Mashed Potatoes,8.7,23 g (0.33 cup),1.652,4.35
"Kind,  Kind Inc.","kind,kind-inc",47.5,0.0,N602652170188,usda-ndb-import,fruit nut bar,1987.0,27.5,7.5,0,,"Kind Fruit & Nut Bar, Peanut Butter & Strawberry",17.5,40 g (1 BAR),0.062,27.5
Kind,kind,52.5,0.0,N602652171253,usda-ndb-import,fruit nut bar,1883.0,27.5,15.0,0,,"Kind Fruit & Nut Bar, Almond & Apricot",10.0,40 g (1.4 oz),0.062,25.0
"Kind,  Kind Inc.","kind,kind-inc",57.5,0.0,N602652177583,usda-ndb-import,fruit nut bar,1987.0,25.0,6.2,0,,"Kind Fruit & Nut Bar, Blueberry, Vanilla, Cashew",10.0,40 g (1 BAR),0.062,27.5
Salpica,salpica,10.0,0.0,N604183320308,usda-ndb-import,salsa con queso,473.0,6.67,0.0,0,,Salpica Salsa Con Queso With Smoked Jalapeno,0.0,30 g (2 Tbsp),0.583,0.0
Great Value,great-value,5.0,0.1,N605388187789,usda-ndb-import,whipped cream cheese,1464.0,35.0,0.0,0,,Great Value Whipped Cream Cheese Spread,5.0,20 g (2 Tbsp),0.325,5.0
Milton's Craft Bakers,milton-s-craft-bakers,66.67,0.0,N606541703013,usda-ndb-import,soft baked cookies,1795.0,19.05,4.8,0,,"Milton's Craft Bakers Soft Baked Cookies, Double Chocolate",4.76,21 g (21 g),0.452,38.1
Milton's,milton-s,70.0,0.0,N606541923527,usda-ndb-import,baked snack crackers,1674.0,10.0,0.0,0,,Milton's Corn Bread Baked Snack Crackers,6.67,30 g (30 g),0.5670000000000001,13.33
Denmark  Inc.,denmark-inc,2.47,0.049,N606995000010,usda-ndb-import,sweet italian sausage,1033.0,16.05,0.0,0,,"Denmark  Inc. Denmark Foods, Arizona Fresh, Sweet Italian Sausage",23.46,81 g (81 g),0.556,0.0
"Southern Home,  Bruno's Supermarkets  Inc.","southern-home,bruno-s-supermarkets-inc",0.0,0.0,N607880040364,usda-ndb-import,vegetable oil spread,1795.0,50.0,0.0,0,,Southern Home Vegetable Oil Spread,0.0,14 g (1 Tbsp),0.75,0.0
"Uncle Ray's,  Uncle Rays  Llc","uncle-ray-s,uncle-rays-llc",57.14,0.0,N614156061718,usda-ndb-import,potato chips cheddar,2389.0,35.71,3.6,0,,"Uncle Ray's Potato Chips, Cheddar & Sour Cream",7.14,28 g (12 CHIPS | ABOUT),1.036,3.57
