brands,brands_tags,carbohydrates_100g,cholesterol_100g,code,creator,demo_cat,energy_100g,fat_100g,fiber_100g,hos,image_url,product_name,proteins_100g,serving_size,sodium_100g,sugars_100g
Guiltless Gourmet,guiltless-gourmet,78.57,0.0,N901000017,usda-ndb-import,yellow corn tortilla,1795.0,10.71,7.1,0,,Guiltless Gourmet Yellow Corn Tortilla Chips,7.14,28 g (1 oz),0.643,0.0
Trader Joe's,trader-joe-s,5.65,0.008,N98601,usda-ndb-import,chicken noodle soup,151.0,0.4,0.4,0,,Trader Joe's Chicken Noodle Soup,2.42,248 g (1 cup),0.294,0.4
"Bakery Fresh Goodness,  The Kroger Co.","bakery-fresh-goodness,the-kroger-co",77.65,0.024,N11110197900,usda-ndb-import,red velvet cake,1971.0,17.65,0.0,0,,"Bakery Fresh Goodness Triple Layer Red Velvet Cake, Peppermint",1.18,85 g (1 SLICE),0.353,65.88
The Kroger Co.,the-kroger-co,44.44,0.032,N11110577276,usda-ndb-import,ice cream sandwich,1130.0,9.52,1.6,0,,The Kroger Co. Ice Cream Sandwich,4.76,63 g (1 SANDWICH),0.23800000000000002,20.63
Simple Truth Organic,simple-truth-organic,18.75,0.0,N11110791559,usda-ndb-import,crunchy peanut butter,2615.0,50.0,9.4,0,,Simple Truth Organic Crunchy Peanut Butter,25.0,32 g (2 Tbsp),0.375,6.25
Kroger,kroger,53.57,0.0,N11110796486,usda-ndb-import,cooked potato chips,2243.0,32.14,3.6,0,,"Kroger Kettle Cooked Potato Chips, Sea Salt & Cracked Pepper",7.14,28 g (1 oz),0.39299999999999996,0.0
Kroger,kroger,21.43,0.0,N11110819376,usda-ndb-import,dry roasted peanuts,2389.0,46.43,7.1,0,,Kroger Dry Roasted Peanuts,21.43,28 g (1 oz),0.607,3.57
P$$T... Big Savings... Pass It On,p-t-big-savings-pass-it-on,0.0,0.0,N11110836281,usda-ndb-import,vegetable oil spread,2092.0,50.0,0.0,0,,P$$T... Big Savings... Pass It On 53% Vegetable Oil Spread,0.0,14 g (1 Tbsp),0.643,0.0
Kroger,kroger,8.8,0.004,N11110837158,usda-ndb-import,mushroom condensed soup,268.0,2.0,0.0,0,,Kroger 98% Fat Free Cream Of Mushroom Condensed Soup,1.6,125 g (0.5 cup),0.64,1.6
Kroger,kroger,14.0,0.01,N11110839305,usda-ndb-import,chili with beans,502.0,4.0,4.4,0,,Kroger Chili With Beans,6.8,250 g (1 cup),0.496,2.0
Kroger,kroger,8.9,0.03,N11110839510,usda-ndb-import,corned beef hash,707.0,10.17,0.8,0,,Kroger Corned Beef Hash,9.32,236 g (1 cup),0.39,0.42
Kroger,kroger,78.95,0.0,N11110852748,usda-ndb-import,instant mashed potatoes,1540.0,0.0,5.3,0,,Kroger Instant Mashed Potatoes,10.53,19 g (0.33 cup),0.079,0.0
"Kroger,  The Kroger Co.","kroger,the-kroger-co",18.18,0.068,N11110863997,usda-ndb-import,cream cheese spread,1331.0,22.73,0.0,0,,"Kroger Cream Cheese Spread, Whipped Strawberry",4.55,22 g (2 Tbsp),0.22699999999999998,13.64
The Kroger Co.,the-kroger-co,0.0,0.045,N11110888082,usda-ndb-import,chunk light tuna,523.0,4.46,0.0,0,,The Kroger Co. Chunk Light Tuna In Oil,19.64,56 g (2 OZ DRAINED),0.321,0.0
Unilever,unilever,0.0,,N11115224274,usda-ndb-import,vegetable oil spread,1197.0,28.57,,0,,"Unilever Imperial, 30% Vegetable Oil Spread",0.0,14 g (1 Tbsp),0.643,
Unilever,unilever,0.0,0.0,N11115621240,usda-ndb-import,vegetable oil spread,2389.0,57.14,,0,,"Unilever Promise, Buttery, 60% Vegetable Oil Spread",0.0,14 g (1 Tbsp),0.607,
Roundy's,roundy-s,0.0,0.045,N11150001298,usda-ndb-import,chunk white albacore,523.0,0.89,0.0,0,,Roundy's Chunk White Albacore Tuna In Water,25.0,56 g (0.25 cup),0.46399999999999997,0.0
Simply Roundy's,simply-roundy-s,57.14,0.0,N11150040419,usda-ndb-import,yellow corn tortilla,2092.0,25.0,7.1,0,,Simply Roundy's Organic Yellow Corn Tortilla Chips,7.14,28 g (1 oz),0.5710000000000001,0.0
Roundy's,roundy-s,54.39,0.0,N11150041430,usda-ndb-import,potato chips cheddar,2201.0,31.58,3.5,0,,"Roundy's Potato Chips, Cheddar & Sour Cream",7.02,57 g (1 PACKAGE),0.596,1.75
Roundy's,roundy-s,9.6,0.004,N11150100205,usda-ndb-import,chicken condensed soup,268.0,2.0,0.8,0,,Roundy's Cream Of Chicken Condensed Soup,1.6,125 g (0.5 cup),0.64,0.8
Roundy's,roundy-s,7.2,0.008,N11150100304,usda-ndb-import,mushroom condensed soup,234.0,2.0,1.6,0,,Roundy's Cream Of Mushroom Condensed Soup,2.4,125 g (0.5 cup),0.36,0.0
Roundy's,roundy-s,78.95,0.0,N11150183482,usda-ndb-import,instant mashed potatoes,1540.0,0.0,5.3,0,,Roundy's Instant Mashed Potatoes,10.53,19 g (0.33 cup),0.079,0.0
Roundy's,roundy-s,78.95,0.0,N11150183499,usda-ndb-import,instant mashed potatoes,1540.0,0.0,5.3,0,,Roundy's Instant Mashed Potatoes,10.53,19 g (0.33 cup),0.079,0.0
Roundy's,roundy-s,4.29,0.086,N11150538008,usda-ndb-import,hot italian sausage,1377.0,25.71,0.0,0,,Roundy's Hot Italian Sausage,20.0,70 g (1 GRILLED LINK),1.043,4.29
Roundy's,roundy-s,2.86,0.086,N11150538022,usda-ndb-import,sweet italian sausage,1377.0,25.71,0.0,0,,Roundy's Sweet Italian Sausage,20.0,70 g (1 GRILLED LINK),0.871,2.86
Roundy's,roundy-s,24.71,0.0,N11150550086,usda-ndb-import,french fried potatoes,787.0,9.41,2.4,0,,Roundy's Curly French Fried Potatoes,2.35,85 g (3 ONZ),0.435,0.0
Roundy's,roundy-s,27.78,0.019,N11150589147,usda-ndb-import,ice cream bars,699.0,5.56,0.0,0,,"Roundy's Ice Cream Bars, Orange",1.85,54 g (54 g),0.065,18.52
Roundy's,roundy-s,36.36,0.026000000000000002,N11150590037,usda-ndb-import,ice cream bars,1795.0,29.87,2.6,0,,Roundy's Ice Cream Bars,3.9,77 g (77 g),0.11699999999999999,31.17
"Shurfine,  Topco Associates  Inc.","shurfine,topco-associates-inc",56.67,0.0,N11161030577,usda-ndb-import,baked snack crackers,1674.0,15.0,0.0,0,,Shurfine Baked Snack Crackers,6.67,30 g (40 CRACKERS),0.733,3.33
Shurfine,shurfine,57.14,0.0,N11161031352,usda-ndb-import,classic potato chips,2389.0,35.71,3.6,0,,Shurfine Classic Potato Chips,7.14,28 g (17 CHIPS),0.643,0.0
Shurfine,shurfine,57.14,0.0,N11161031406,usda-ndb-import,classic potato chips,2389.0,35.71,3.6,0,,Shurfine Classic Potato Chips,7.14,28 g (17 CHIPS),0.643,0.0
Shur Fine,shur-fine,57.14,0.0,N11161031932,usda-ndb-import,potato chips cheddar,2243.0,32.14,3.6,0,,"Shur Fine Potato Chips, Cheddar & Sour Cream",7.14,28 g (13 CHIPS),0.7859999999999999,3.57
Shurfine,shurfine,26.67,0.0,N11161033943,usda-ndb-import,honey roasted peanuts,2648.0,50.0,6.7,0,,Shurfine Honey Roasted Peanuts,20.0,30 g (0.25 cup),0.4,16.67
"Shurfine,  Topco Associates  Inc.","shurfine,topco-associates-inc",62.5,0.0,N11161035589,usda-ndb-import,cookies chocolate chip,2092.0,28.12,3.1,0,,"Shurfine Real Chunky Cookies, Chocolate Chip",3.12,32 g (2 COOKIES),0.344,31.25
Spartan,spartan,8.0,0.008,N11213021645,usda-ndb-import,chicken condensed soup,402.0,6.4,0.8,0,,Spartan Cream Of Chicken Condensed Soup,2.4,125 g (0.5 cup),0.64,0.8
Spartan,spartan,53.57,0.0,N11213027326,usda-ndb-import,wavy potato chips,2389.0,35.71,3.6,0,,Spartan Wavy Potato Chips,7.14,28 g (15 CHIPS | ABOUT),0.5,0.0
Spartan,spartan,46.43,0.0,N11213027388,usda-ndb-import,popcorn white cheddar,2540.0,42.86,7.1,0,,"Spartan Popcorn, White Cheddar",7.14,28 g (1 ONZ),0.893,3.57
Spartan,spartan,70.45,0.0,N11213082998,usda-ndb-import,pancake waffle mix,1427.0,3.41,2.3,0,,Spartan Complete Pancake & Waffle Mix Buttermilk,9.09,44 g (0.33 cup),1.091,11.36
Spartan,spartan,8.82,0.015,N11213088686,usda-ndb-import,salsa con queso,494.0,8.82,0.0,0,,"Spartan Salsa, Con Queso, Medium",2.94,34 g (2 Tbsp),0.8240000000000001,2.94
Spartan,spartan,16.67,0.0,N11213147796,usda-ndb-import,roasted salted almonds,2556.0,55.56,11.1,0,,Spartan Fresh Selection Roasted & Salted Almonds,22.22,36 g (0.25 cup),0.33299999999999996,5.56
"Valu Time,  Topco","valu-time,topco",18.75,0.016,N11225022159,usda-ndb-import,thousand island dressing,1046.0,18.75,0.0,0,,Valu Time Thousand Island Dressing,0.0,32 g (2 Tbsp),0.938,15.62
"Valu Time,  Kingston Marketing Co","valu-time,kingston-marketing-co",50.0,0.0,N11225028304,usda-ndb-import,honey roasted peanuts,2092.0,32.14,3.6,0,,Valu Time Honey Roasted Peanuts,14.29,28 g (1 ONZ),0.125,39.29
Hawaiian,hawaiian,53.57,0.0,N11594160056,usda-ndb-import,style potato chips,2092.0,32.14,3.6,0,,"Hawaiian Kettle Style Potato Chips, Original",3.57,28 g (1 oz),0.39299999999999996,0.0
"Big Win,  Rite Aid Corporation","big-win,rite-aid-corporation",21.43,0.0,N11822222471,usda-ndb-import,dry roasted peanuts,2389.0,50.0,7.1,0,,Big Win Dry Roasted Peanuts,25.0,28 g (0.25 CUP | ABOUT),0.268,3.57
Rite Aid Corporation,rite-aid-corporation,67.5,0.0,N11822584371,usda-ndb-import,steel cut oats,1569.0,6.25,10.0,0,,"Rite Aid Corporation B4y, Quick Cooking Steel Cut Oats",12.5,40 g (0.25 cup),0.0,2.5
Big Win,big-win,25.0,0.0,N11822667371,usda-ndb-import,dry roasted peanuts,2389.0,46.43,7.1,0,,"Big Win Dry Roasted Peanuts, Salted",21.43,28 g (1 ONZ),0.7140000000000001,3.57
Landies Candies Co. Inc.,landies-candies-co-inc,80.95,0.012,N13065503409,usda-ndb-import,chocolate covered pretzels,1795.0,11.9,0.0,0,,"Landies Candies Co. Inc. Landies Candies, Vanilla Creme Filled Chocolate Covered Pretzels",4.76,42 g (1.5 ONZ),0.083,54.76
Landies Candies Co. Inc.,landies-candies-co-inc,52.38,0.012,N13065504260,usda-ndb-import,chocolate covered pretzels,2293.0,30.95,4.8,0,,Landies Candies Co. Inc. Milk Chocolate Covered Pretzels,11.9,42 g (1.5 ONZ),0.16699999999999998,28.57
Landies Candies Co. Inc.,landies-candies-co-inc,66.67,0.0,N13065504277,usda-ndb-import,chocolate covered pretzels,1891.0,19.05,4.8,0,,"Landies Candies Co. Inc. Landies Candies, Dark Chocolate Covered Pretzels, Almond Butter",9.52,42 g (1.5 ONZ),0.179,38.1
Cream Of Wheat,cream-of-wheat,80.0,0.0,N13130060530,usda-ndb-import,instant hot cereal,1552.0,0.0,2.9,0,,"Cream Of Wheat Instant Hot Cereal, Maple Brown Sugar",5.71,35 g (1.23 oz),0.4,37.14
Annie's,annie-s,75.0,0.0,N13562460502,usda-ndb-import,chewy granola bars,1644.0,12.5,10.7,0,,"Annie's Chewy Granola Bars, Double Chocolate Chip",3.57,28 g (1 BAR),0.14300000000000002,25.0
Annie's,annie-s,54.55,0.0,N13562490189,usda-ndb-import,cinnamon rolls with,1393.0,12.12,2.0,0,,Annie's Organic Cinnamon Rolls With Icing,4.04,99 g (1 ROLL WITH ICING),0.778,24.24
Torrance Blvd  Torrance,torrance-blvd-torrance,54.17,0.042,N13964380507,usda-ndb-import,cookies peanut butter,1745.0,20.83,4.2,0,,"Torrance Blvd  Torrance The Good Cookies & Beyond, Chocolate Chip Cookies, Peanut Butter",12.5,24 g (1 COOKIE),0.375,29.17
Wonderful Pistachios & Almonds Llc,wonderful-pistachios-almonds-llc,22.0,0.0,N14113210317,usda-ndb-import,roasted salted almonds,2510.0,52.0,10.0,0,,Wonderful Pistachios & Almonds Llc Roasted & Salted Almonds,22.0,50 g (0.5 cup),0.34,4.0
Wonderful Pistachios & Almonds Llc,wonderful-pistachios-almonds-llc,20.0,0.0,N14113210690,usda-ndb-import,roasted salted almonds,2510.0,53.33,10.0,0,,"Wonderful Pistachios & Almonds Llc Wonderful, Roasted & Salted Almonds",20.0,30 g (0.25 cup),0.4,3.33
Wonderful Pistachios & Almonds Llc,wonderful-pistachios-almonds-llc,20.0,0.0,N14113210744,usda-ndb-import,roasted salted almonds,2510.0,53.33,10.0,0,,"Wonderful Pistachios & Almonds Llc Wonderful, Roasted & Salted Almonds",20.0,30 g (0.25 cup),0.4,3.33
Western Family,western-family,9.32,0.034,N15400018579,usda-ndb-import,corned beef hash,586.0,10.17,0.8,0,,Western Family Traditional Corned Beef Hash,8.47,236 g (1 cup),0.424,0.42
Western Family,western-family,17.86,0.0,N15400023832,usda-ndb-import,dry roasted peanuts,2389.0,50.0,7.1,0,,Western Family Unsalted Dry Roasted Peanuts,25.0,28 g (1 oz),0.0,3.57
Western Family Foods  Inc.,western-family-foods-inc,27.69,0.046,N15400224963,usda-ndb-import,premium ice cream,967.0,12.31,0.0,0,,Western Family Foods  Inc. Creamery Select Premium Ice Cream,3.08,65 g (0.5 cup),0.077,21.54
Western Family Foods  Inc.,western-family-foods-inc,18.75,0.0,N15400454759,usda-ndb-import,crunchy peanut butter,2615.0,50.0,6.2,0,,Western Family Foods  Inc. Crunchy Peanut Butter,21.88,32 g (2 Tbsp),0.375,9.38
Western Family Foods  Inc.,western-family-foods-inc,72.0,0.0,N15400554435,usda-ndb-import,soft baked cookies,1841.0,14.0,0.0,0,,Western Family Foods  Inc. Soft Baked Cookies,4.0,25 g (1 COOKIE),0.36,36.0
"Kettle,  Shurfine","kettle,shurfine",53.57,0.0,N15400875677,usda-ndb-import,cooked potato chips,2243.0,32.14,3.6,0,,Kettle Cooked Potato Chips,7.14,28 g (18 CHIPS) | (ABOUT),0.607,0.0
Garden Of Eatin',garden-of-eatin,64.29,0.0,N15839008820,usda-ndb-import,pico de gallo,2092.0,25.0,10.7,0,,"Garden Of Eatin' Garden Of Eatin', Corn Tortilla Chips, Pico De Gallo",7.14,28 g (1 oz),0.536,0.0
Garden Of Eatin',garden-of-eatin,60.71,0.0,N15839020266,usda-ndb-import,white corn tortilla,2092.0,25.0,7.1,0,,"Garden Of Eatin' Garden Of Eatin', White Corn Tortilla Chips",7.14,28 g (1 oz),0.268,0.0
Chiu Hop Company,chiu-hop-company,0.0,0.0,N15984020036,usda-ndb-import,vegetable oil spread,2092.0,50.0,,0,,"Chiu Hop Company Redner's, Vegetable Oil Spread",0.0,14 g (1 Tbsp),0.75,
"Lunds & Byerlys,  Byerly Foods International","lunds-byerlys,byerly-foods-international",60.71,0.025,N18169482025,usda-ndb-import,oatmeal raisin cookies,1795.0,16.07,3.6,0,,Lunds & Byerlys Oatmeal Raisin Cookies,3.57,28 g (1 COOKIE),0.196,39.29
Seneca Foods Corporation,seneca-foods-corporation,64.29,0.0,N18195707604,usda-ndb-import,sweet potato chips,2243.0,25.0,14.3,0,,"Seneca Foods Corporation Seneca, Crispy Sweet Potato Chips, Cinnamon",3.57,28 g (1 oz),0.107,28.57
Big Y Foods  Inc.,big-y-foods-inc,67.86,0.0,N18894000150,usda-ndb-import,white corn tortilla,2092.0,21.43,3.6,0,,Big Y Foods  Inc. White Corn Tortilla Chips,7.14,28 g (8 CHIPS) | (ABOUT),0.75,3.57
Big Y,big-y,67.86,0.0,N18894004028,usda-ndb-import,white corn tortilla,2092.0,21.43,7.1,0,,Big Y White Corn Tortilla Chips,7.14,28 g (8 CHIPS | ABOUT),0.304,0.0
"Big Y,  Big Y Foods  Inc.","big-y,big-y-foods-inc",68.0,0.0,N18894119968,usda-ndb-import,oatmeal raisin cookies,1841.0,16.0,4.0,0,,Big Y Oatmeal Raisin Cookies,4.0,25 g (1 COOKIE),0.34,32.0
Big Y,big-y,5.88,0.071,N18894329619,usda-ndb-import,italian style meatballs,1180.0,22.35,1.2,0,,Big Y Italian Style Meatballs,16.47,85 g (3 MEATBALLS),0.682,1.18
Big Y,big-y,68.57,0.006999999999999999,N18894360100,usda-ndb-import,macaroni cheese dinner,1494.0,2.86,2.9,0,,Big Y Macaroni N' Cheese Dinner,14.29,70 g (0.5 CUP MACARONI AND 2 TABLESPOONS DRY CHEESE MIX) MAKES ABOUT 1 CUP PREAPARED | (ABOUT),0.871,8.57
Big Y,big-y,8.82,0.015,N18894824169,usda-ndb-import,salsa con queso,494.0,8.82,0.0,0,,Big Y Salsa Con Queso,2.94,34 g (2 Tbsp),0.8240000000000001,2.94
"Toft's,  Toft Dairy Inc.","toft-s,toft-dairy-inc",27.4,0.034,N19473006563,usda-ndb-import,peanut butter cup,1033.0,13.7,1.4,0,,"Toft's Ice Cream, Peanut Butter Cup",5.48,73 g (0.5 cup),0.185,20.55
Harmons,harmons,0.0,0.054000000000000006,N19646050140,usda-ndb-import,chunk light tuna,448.0,0.89,0.0,0,,Harmons Skipjack Chunk Light Tuna In Water,26.79,56 g (0.25 cup),0.321,0.0
Cedar Crest Specialties Inc.,cedar-crest-specialties-inc,29.33,0.02,N20652002214,usda-ndb-import,peanut butter cup,1172.0,17.33,1.3,0,,"Cedar Crest Specialties Inc. Cedar Crest, Ice Cream, Peanut Butter Cup",4.0,75 g (0.5 cup),0.2,26.67
"Cape Cod,  Cape Cod Potato Chips Inc.","cape-cod,cape-cod-potato-chips-inc",58.27,0.0,N20685000560,usda-ndb-import,cooked potato chips,2125.0,28.2,3.8,0,,Cape Cod Kettle Cooked Potato Chips,7.52,53.2 g (1 PACKAGE),0.526,0.0
"Cape Cod,  Cape Cod Potato Chips Inc.","cape-cod,cape-cod-potato-chips-inc",64.29,0.0,N20685001086,usda-ndb-import,potato chips original,2092.0,21.43,7.1,0,,"Cape Cod Kettle Cooked Potato Chips, Original",7.14,28 g (19 CHIPS | ABOUT),0.304,0.0
"Cape Cod,  Cape Cod Potato Chips Inc.","cape-cod,cape-cod-potato-chips-inc",64.29,0.0,N20685001413,usda-ndb-import,cooked potato chips,2092.0,21.43,3.6,0,,"Cape Cod Waffle Cut Kettle Cooked Potato Chips, Buffalo Cheddar",7.14,28 g (17 CHIPS | ABOUT),0.446,3.57
"Cape Cod,  Cape Cod Potato Chips Inc.","cape-cod,cape-cod-potato-chips-inc",60.71,0.0,N20685001512,usda-ndb-import,cooked potato chips,2092.0,25.0,3.6,0,,"Cape Cod Kettle Cooked Potato Chips, Roasted Black Garlic",3.57,28 g (18 CHIPS | ABOUT),0.9640000000000001,3.57
"Cape Cod,  Cape Cod Potato Chips Inc.","cape-cod,cape-cod-potato-chips-inc",61.03,0.0,N20685001536,usda-ndb-import,potato chips original,2159.0,28.17,4.7,0,,"Cape Cod Kettle Cooked Potato Chips, Original",9.39,21.3 g (1 PACKAGE),0.54,0.0
"Cape Cod,  Cape Cod Potato Chips Inc.","cape-cod,cape-cod-potato-chips-inc",65.73,0.0,N20685600104,usda-ndb-import,cooked potato chips,1962.0,21.13,4.7,0,,Cape Cod Original Kettle Cooked Potato Chips,9.39,21.3 g (1 PACKAGE),0.305,0.0
Turkey Hill,turkey-hill,28.79,0.038,N20735110249,usda-ndb-import,chocolate chip cookie,1013.0,12.12,0.0,0,,"Turkey Hill Premium Ice Cream, Chocolate Chip Cookie Dough",3.03,66 g (0.5 cup),0.114,19.7
Philadelphia,philadelphia,18.75,0.047,N21000007295,usda-ndb-import,cream cheese spread,1046.0,15.62,0.0,0,,"Philadelphia Cream Cheese Spread, Honey Pecan",6.25,32 g (2 Tbsp),0.359,15.62
Philadelphia,philadelphia,9.09,0.068,N21000036257,usda-ndb-import,whipped cream cheese,950.0,20.45,0.0,0,,Philadelphia Whipped Cream Cheese Spread,4.55,22 g (2 Tbsp),0.409,4.55
Philadelphia,philadelphia,22.73,0.068,N21000045839,usda-ndb-import,whipped cream cheese,1142.0,18.18,0.0,0,,"Philadelphia Whipped Cream Cheese Spread, Mixed Berry",4.55,22 g (2 Tbsp),0.341,18.18
Philadelphia,philadelphia,3.57,0.071,N21000050260,usda-ndb-import,cream cheese spread,1046.0,25.0,0.0,0,,"Philadelphia Cream Cheese Spread, Original",3.57,28 g (1 POUCH),0.41100000000000003,3.57
Signature Cafe,signature-cafe,11.34,0.01,N21130069521,usda-ndb-import,salad with chicken,678.0,10.65,1.7,0,,Signature Cafe Asian Style Salad With Chicken,5.84,291 g (291 g),0.313,5.15
Lucerne Dairy Farms,lucerne-dairy-farms,42.86,0.027000000000000003,N21130087921,usda-ndb-import,ice cream sandwiches,1121.0,8.93,1.8,0,,Lucerne Dairy Farms Ice Cream Sandwiches,3.57,56 g (1 SANDWICH),0.196,23.21
"Signature,  Safeway  Inc.","signature,safeway-inc",25.0,0.0,N21130092024,usda-ndb-import,french fried potatoes,649.0,4.76,2.4,0,,"Signature Kithens, French Fried Potatoes",2.38,84 g (15 2- INCH PIECES | ABOUT),0.33299999999999996,1.19
Signature Kitchens,signature-kitchens,23.81,0.0,N21130092062,usda-ndb-import,french fried potatoes,649.0,5.95,2.4,0,,Signature Kitchens Crinkle Cut French Fried Potatoes,2.38,"84 g (20 , 2-INCH PIECES) | ABOUT)",0.33299999999999996,1.19
Signature Select,signature-select,22.39,0.052000000000000005,N21130098767,usda-ndb-import,chocolate ice cream,937.0,13.43,1.5,0,,Signature Select Chocolate Ice Cream,4.48,67 g (0.5 cup),0.09,17.91
Oven Joy,oven-joy,41.86,0.0,N21130120499,usda-ndb-import,hot dog buns,1071.0,3.49,2.3,0,,Oven Joy Hot Dog Buns,6.98,43 g (1 BUN),0.442,4.65
Safeway  Inc.,safeway-inc,2.0,0.04,N21130152926,usda-ndb-import,roasted turkey breast,418.0,1.0,0.0,0,,"Safeway  Inc. Primo Taglio, Oven Roasted Turkey Breast",22.0,50 g (3 SLICES),0.96,2.0
"Safeway Kitchens,  Safeway  Inc.","safeway-kitchens,safeway-inc",64.29,0.0,N21130306282,usda-ndb-import,baked snack crackers,1941.0,17.86,3.6,0,,"Safeway Kitchens Baked Snack Crackers, Sesame Thin Wheat",10.71,28 g (13 CRACKERS),0.929,10.71
Safeway  Inc.,safeway-inc,9.32,0.034,N21130359035,usda-ndb-import,corned beef hash,674.0,10.17,0.8,0,,Safeway  Inc. Corned Beef Hash,7.63,236 g (1 cup),0.424,0.42
Signature Kitchens,signature-kitchens,12.15,0.012,N21130405039,usda-ndb-import,chili with beans,423.0,3.64,2.8,0,,Signature Kitchens Chili With Beans,5.26,247 g (1 cup),0.364,1.21
"Winn-Dixie,  Winn-Dixie Stores  Inc.","winn-dixie,winn-dixie-stores-inc",70.0,0.0,N21140025968,usda-ndb-import,steel cut oats,1569.0,6.25,10.0,0,,Winn-Dixie Steel Cut Oats,12.5,40 g (0.25 cup),0.0,0.0
"Winn-Dixie,  Winn-Dixie Stores  Inc.","winn-dixie,winn-dixie-stores-inc",66.67,0.0,N21140027238,usda-ndb-import,chicken gravy mix,1393.0,8.33,0.0,0,,Winn-Dixie Chicken Gravy Mix,0.0,6 g (2 tsp),5.167000000000001,16.67
"Winn Dixie,  Winn-Dixie Stores  Inc.","winn-dixie,winn-dixie-stores-inc",53.57,0.0,N21140152282,usda-ndb-import,wavy potato chips,2243.0,35.71,3.6,0,,"Winn Dixie Wavy Potato Chips, Original",7.14,28 g (12 CHIPS | ABOUT),0.48200000000000004,3.57
Fareway Stores  Inc.,fareway-stores-inc,57.14,0.0,N21333050227,usda-ndb-import,style potato chips,2243.0,32.14,3.6,0,,Fareway Stores  Inc. Old Fashioned Kettle Style Potato Chips,7.14,28 g (12 CHIPS),0.7859999999999999,3.57
"Cascadian Farm,  Small Planet Foods  Inc.","cascadian-farm,small-planet-foods-inc",77.14,0.0,N21908134734,usda-ndb-import,chewy granola bars,1552.0,5.71,2.9,0,,"Cascadian Farm Chewy Granola Bars, Harvest Berry",5.71,35 g (1 BAR),0.214,31.43
Larabar,larabar,62.22,0.0,N21908488172,usda-ndb-import,chocolate chip cookie,1954.0,24.44,6.7,0,,"Larabar Bars, Chocolate Chip Cookie Dough",8.89,45 g (45 g),0.122,35.56
Food Should Taste Good,food-should-taste-good,57.14,0.0,N21908812793,usda-ndb-import,sweet potato chips,2389.0,32.14,10.7,0,,Food Should Taste Good Original Sweet Potato Chips,3.57,28 g (14 CHIPS) | (ABOUT),0.33899999999999997,14.29
Snyder Of Berlin,snyder-of-berlin,50.0,0.0,N23000436976,usda-ndb-import,wavy potato chips,2243.0,32.14,3.6,0,,Snyder Of Berlin Crispy & Wavy Potato Chips,7.14,28 g (1 oz),0.75,0.0
Snyder Of Berlin,snyder-of-berlin,39.29,0.018000000000000002,N23000438659,usda-ndb-import,popcorn white cheddar,2389.0,46.43,7.1,0,,"Snyder Of Berlin Popcorn, White Cheddar",10.71,28 g (1 oz),1.464,3.57
"Contadina,  Contadina Foods  Inc.","contadina,contadina-foods-inc",6.56,0.0,N24000343462,usda-ndb-import,tomato sauce with,138.0,0.0,1.6,0,,Contadina Tomato Sauce With Natural Sea Salt,1.64,61 g (0.25 cup),0.45899999999999996,3.28
Sunbelt Bakery,sunbelt-bakery,65.62,0.0,N24300031113,usda-ndb-import,chewy granola bars,2092.0,21.88,3.1,0,,"Sunbelt Bakery Fudge Dipped Chewy Granola Bars, Chocolate Chip",6.25,32 g (32 g),0.156,34.38
San Miguel,san-miguel,6.67,0.0,N24456091030,usda-ndb-import,pico de gallo,138.0,0.0,1.7,0,,San Miguel Medium Salsa Pico De Gallo Sauce,1.67,60 g (60 g),0.5670000000000001,3.33
Applegate,applegate,0.0,0.054000000000000006,N25317579001,usda-ndb-import,smoked turkey breast,372.0,0.0,0.0,0,,Applegate Smoked Turkey Breast,21.43,56 g (2 oz),0.643,0.0
Silver Star,silver-star,2.2,0.06,N26956011457,usda-ndb-import,hot italian sausage,1059.0,18.68,1.1,0,,Silver Star Hot Italian Sausage,16.48,91 g (1 LINK),0.7909999999999999,1.1
Glenn Foods Inc.,glenn-foods-inc,56.25,0.0,N27393016302,usda-ndb-import,fruit nut bar,1699.0,14.06,9.4,0,,"Glenn Foods Inc. Glennys, Greek Yogurt Fruit & Nut Bar, Chocolate Cherry",15.62,32 g (1 BAR),0.391,28.12
"Country Crock,  Unilever","country-crock,unilever",7.14,,N27400250620,usda-ndb-import,vegetable oil spread,1343.0,32.14,,0,,"Country Crock Calcium, 32% Vegetable Oil Spread",0.0,14 g (1 Tbsp),0.7140000000000001,
Healthy Ones,healthy-ones,5.56,0.046,N27815179936,usda-ndb-import,smoked turkey breast,464.0,3.7,,0,,Healthy Ones Honey Smoked Turkey Breast,14.81,54 g (54 g),0.648,3.7
Premio,premio,5.36,0.08900000000000001,N28364120325,usda-ndb-import,hot italian sausage,1418.0,25.0,0.0,0,,Premio Hot Italian Sausage,19.64,56 g (56 g),0.7859999999999999,5.36
Premio,premio,4.71,0.08199999999999999,N28364142983,usda-ndb-import,hot italian sausage,1427.0,25.88,0.0,0,,Premio Hot Italian Sausage,20.0,85 g (1 PAN FRIED LINK),0.7879999999999999,4.71
Premio,premio,3.53,0.08199999999999999,N28364212853,usda-ndb-import,sweet italian sausage,1427.0,25.88,0.0,0,,Premio Sweet Italian Sausage,21.18,85 g (1 PAN COOKED LINK),0.8,2.35
Premio,premio,1.96,0.08800000000000001,N28364213416,usda-ndb-import,hot italian sausage,1314.0,25.49,0.0,0,,Premio Hot Italian Sausage,19.61,51 g (1 PAN FRIED LINK),0.8240000000000001,1.96
Premio,premio,3.53,0.08199999999999999,N28364213874,usda-ndb-import,sweet italian sausage,1427.0,25.88,0.0,0,,Premio Sweet Italian Sausage,21.18,85 g (1 PAN FRIED LINK),0.753,3.53
Premio Foods  Inc.,premio-foods-inc,4.71,0.08199999999999999,N28364213881,usda-ndb-import,hot italian sausage,1427.0,25.88,0.0,0,,Premio Foods  Inc. Hot Italian Sausage,20.0,85 g (1 PAN FRIED LINK),0.7879999999999999,4.71
Premio Foods  Inc.,premio-foods-inc,1.43,0.079,N28364216172,usda-ndb-import,sweet italian sausage,1197.0,22.86,0.0,0,,"Premio Foods  Inc. Premio, Sweet Italian Sausage With Broccoli Rabe & Romano Cheese",18.57,70 g (1 PAN FRIED LINK),0.871,1.43
Premio,premio,3.57,0.08900000000000001,N28364410174,usda-ndb-import,sweet italian sausage,1418.0,25.0,0.0,0,,Premio Sweet Italian Sausage,21.43,56 g (2 ONZ),0.9109999999999999,1.79
Premio,premio,5.36,0.08900000000000001,N28364410181,usda-ndb-import,hot italian sausage,1418.0,25.0,0.0,0,,Premio Hot Italian Sausage,21.43,56 g (2 ONZ),1.089,3.57
"Smartfood,  Frito-Lay Company","smartfood,frito-lay-company",65.73,0.0,N28400604468,usda-ndb-import,popcorn white cheddar,1962.0,18.78,9.4,0,,"Smartfood Delight, Air Popped Popcorn, White Cheddar",9.39,21.3 g (1 PACKAGE),0.7040000000000001,4.69
La Sirena,la-sirena,0.0,0.037000000000000005,N28571000502,usda-ndb-import,tomato sauce with,586.0,8.0,0.0,0,,"La Sirena Pica Pica, Sardines In Tomato Sauce With Chili",17.0,100 g (100 g),0.163,0.0
Otis Mcallister Inc.,otis-mcallister-inc,0.0,0.037000000000000005,N28571000601,usda-ndb-import,tomato sauce with,586.0,8.0,0.0,0,,Otis Mcallister Inc. Sardines In Tomato Sauce With Chili,17.0,100 g (100 GRM),0.163,0.0
La Sirena,la-sirena,0.0,0.037000000000000005,N28571010334,usda-ndb-import,tomato sauce with,586.0,8.0,0.0,0,,La Sirena Sardines With Jalapenos In Spicy Tomato Sauce With Jalapenos,17.0,100 g (100 g),0.163,0.0
"Jewel Osco,  Regal Health Food International  Inc.","jewel-osco,regal-health-food-international-inc",46.67,0.003,N28744547018,usda-ndb-import,dark chocolate almonds,2230.0,40.0,6.7,0,,Jewel Osco Dark Chocolate Almonds,10.0,30 g (0.25 cup),0.003,36.67
Down Food,down-food,73.08,0.028999999999999998,N29519230098,usda-ndb-import,oatmeal raisin cookies,1933.0,15.38,1.9,0,,Down Food Oatmeal Raisin Cookies,3.85,52 g (52 g),0.615,40.38
Friendly's,friendly-s,26.87,0.037000000000000005,N29839005710,usda-ndb-import,premium ice cream,874.0,10.45,0.0,0,,"Friendly's Premium Ice Cream, Rich & Creamy Strawberry",2.99,67 g (0.5 cup),0.052000000000000005,19.4
