Schnucks,schnucks,67.74,0.0,N41318241044,usda-ndb-import,baked snack crackers,1753.0,19.35,9.7,0,,Schnucks Baked Snack Crackers,9.68,31 g (31 g),0.645,0.0
Schnucks,schnucks,51.76,0.018000000000000002,N41318311648,usda-ndb-import,red velvet cake,1477.0,15.29,0.0,0,,Schnucks Delux Petite Red Velvet Cake,2.35,85 g (0.166 CAKE),0.365,40.0
Pinnacle Foods Group Llc,pinnacle-foods-group-llc,13.73,0.008,N41321241598,usda-ndb-import,chili with beans,393.0,1.37,3.1,0,,Pinnacle Foods Group Llc Turkey Chili With Beans,7.45,255 g (1 cup),0.365,0.78
Nalley,nalley,9.32,0.032,N41321242076,usda-ndb-import,corned beef hash,745.0,11.02,0.8,0,,Nalley Corned Beef Hash,9.32,236 g (1 cup),0.415,0.42
Farm Rich,farm-rich,5.88,0.053,N41322557735,usda-ndb-import,italian style meatballs,1280.0,24.71,2.4,0,,Farm Rich Italian Style Meatballs,14.12,85 g (3 oz),0.612,1.18
Goya,goya,10.94,0.0,N41331029797,usda-ndb-import,refried black beans,326.0,2.34,3.1,0,,Goya Refried Black Beans,3.91,128 g (0.5 cup),0.42200000000000004,0.0
Jones',jones,57.14,0.0,N41368016401,usda-ndb-import,wavy potato chips,2243.0,32.14,3.6,0,,"Jones' Jones', Wavy Potato Chips",7.14,28 g (1 oz),0.429,0.0
Publix Green Wise,publix-green-wise,21.92,0.048,N41415343436,usda-ndb-import,chocolate ice cream,916.0,12.33,0.0,0,,Publix Green Wise Organic Chocolate Ice Cream,4.11,73 g (0.5 cup),0.048,21.92
"Kemps,  Kemps Llc","kemps,kemps-llc",46.67,0.025,N41483023728,usda-ndb-import,ice cream sandwiches,1184.0,10.0,1.7,0,,"Kemps Ice Cream Sandwiches, Mint Chocolate Chip",3.33,60 g (1 SANDWICH),0.225,26.67
Ittibitz,ittibitz,26.51,0.048,N41483035110,usda-ndb-import,chocolate chip cookie,1008.0,14.46,0.0,0,,"Ittibitz Ice Cream, Chocolate Chip Cookie Dough",3.61,83 g (83 g),0.07200000000000001,16.87
Kemps,kemps,30.77,0.015,N41483038630,usda-ndb-import,peanut butter cup,837.0,6.92,0.0,0,,"Kemps Smooth & Creamy Frozen Yogurt, Chocolate Peanut Butter Cup",4.62,65 g (0.5 cup),0.10800000000000001,23.08
"Kemps,  Kemps Llc","kemps,kemps-llc",46.03,0.032,N41483040459,usda-ndb-import,chocolate ice cream,1197.0,9.52,1.6,0,,Kemps Triple Chocolate Ice Cream Sandwiches,4.76,63 g (1 SANDWICH),0.214,28.57
Weis Markets  Inc.,weis-markets-inc,41.86,0.0,N41497000944,usda-ndb-import,whole grain bread,1071.0,4.65,7.0,0,,Weis Markets  Inc. Whole Grain Bread,11.63,"43 g (1 SLICE, PER CONTAINER)",0.419,6.98
"Weis,  Utz","weis,utz",53.57,0.0,N41497004300,usda-ndb-import,style potato chips,2243.0,32.14,3.6,0,,Weis Kettle Style Potato Chips,7.14,28 g (1 oz),0.429,0.0
"Weis,  Utz","weis,utz",53.57,0.0,N41497004317,usda-ndb-import,style potato chips,2243.0,32.14,3.6,0,,"Weis Kettle Style Potato Chips, Honey Barbeque",7.14,28 g (1 oz),0.643,3.57
Weis,weis,30.3,0.03,N41497012442,usda-ndb-import,premium ice cream,887.0,9.09,0.0,0,,Weis Premium Ice Cream,3.03,66 g (0.5 cup),0.098,22.73
Weis,weis,33.33,0.023,N41497013708,usda-ndb-import,chocolate chip cookie,824.0,6.06,0.0,0,,"Weis Light Ice Cream, Chocolate Chip Cookie Dough",4.55,66 g (0.5 cup),0.083,28.79
Weis Quality,weis-quality,41.18,0.0,N41497025879,usda-ndb-import,dark chocolate almonds,2460.0,44.12,8.8,0,,Weis Quality Dark Chocolate Almonds,11.76,34 g (0.25 cup),0.147,32.35
Weis,weis,26.98,0.016,N41497027545,usda-ndb-import,thin crust pizza,1029.0,10.32,1.6,0,,Weis Supreme Thin Crust Pizza,10.32,126 g (0.2 PIZZA),0.532,3.97
Weis Quality,weis-quality,5.0,0.1,N41497088485,usda-ndb-import,whipped cream cheese,1464.0,35.0,0.0,0,,Weis Quality Whipped Cream Cheese Spread,5.0,20 g (2 Tbsp),0.325,5.0
Weis,weis,66.67,0.0,N41497273447,usda-ndb-import,chicken gravy mix,1393.0,8.33,0.0,0,,"Weis Chicken Gravy Mix, Original",0.0,6 g (2 tsp),5.167000000000001,16.67
Weis Organics,weis-organics,10.48,0.0,N41497277469,usda-ndb-import,organic pasta sauce,272.0,2.02,3.2,0,,Weis Organics Organic Pasta Sauce,1.61,124 g (0.5 cup),0.331,7.26
Weis,weis,9.32,0.034,N41497314355,usda-ndb-import,corned beef hash,674.0,10.17,0.8,0,,Weis Home Style Corned Beef Hash,8.47,236 g (1 cup),0.424,0.42
Weis,weis,17.86,0.0,N41497522316,usda-ndb-import,roasted salted almonds,2540.0,50.0,10.7,0,,"Weis Pardoe's Perky Peanuts, Inc., Roasted Salted Almonds",21.43,28 g (1 oz),0.304,3.57
Weis Markets  Inc.,weis-markets-inc,57.14,0.0,N41497543199,usda-ndb-import,chewy granola bars,2033.0,22.86,2.9,0,,Weis Markets  Inc. Sweet & Salty Chewy Granola Bars,8.57,35 g (1 BAR),0.4,28.57
Weis Quality,weis-quality,70.97,0.0,N41497556397,usda-ndb-import,baked snack crackers,1891.0,16.13,6.5,0,,Weis Quality Thin Wheat Baked Snack Crackers,6.45,31 g (31 g),0.742,12.9
Fit&Active,fit-active,7.2,0.0,N41498157425,usda-ndb-import,mushroom condensed soup,201.0,1.6,0.8,0,,Fit&Active Cream Of Mushroom Condensed Soup,0.8,125 g (0.5 cup),0.32799999999999996,0.8
Fit&Active,fit-active,7.2,0.004,N41498157432,usda-ndb-import,chicken condensed soup,201.0,1.6,0.8,0,,"Fit&Active Cream Of Chicken, Condensed Soup",1.6,125 g (0.5 cup),0.32799999999999996,0.0
Bake House,bake-house,52.53,0.0,N41498159023,usda-ndb-import,cinnamon rolls with,1351.0,10.1,1.0,0,,Bake House Jumbo Cinnamon Rolls With Icing,4.04,99 g (99 g),0.687,24.24
Sundae Shoppe,sundae-shoppe,43.33,0.025,N41498177928,usda-ndb-import,ice cream sandwich,1046.0,8.33,1.7,0,,Sundae Shoppe Ice Cream Sandwich,3.33,60 g (1 SANDWICH),0.217,21.67
"Simply Nature,  Aldi-Benner Company","simply-nature,aldi-benner-company",57.14,0.0,N41498210953,usda-ndb-import,yellow corn tortilla,1941.0,25.0,7.1,0,,Simply Nature Organic Yellow Corn Tortilla Chips,7.14,28 g (10 CHIPS),0.268,0.0
"Clancy's,  Aldi-Benner Company","clancy-s,aldi-benner-company",70.0,0.0,N41498266585,usda-ndb-import,chocolate covered pretzels,1954.0,23.33,3.3,0,,Clancy's Chocolate Covered Pretzels,3.33,30 g (30 GRM),0.5329999999999999,43.33
"First Street,  Smart & Final Iris Corporation","first-street,smart-final-iris-corporation",50.0,0.0,N41512134272,usda-ndb-import,dark chocolate almonds,2372.0,36.67,6.7,0,,First Street Dark Chocolate Almonds,10.0,30 g (8 PIECES),0.0,40.0
Ahold,ahold,31.11,0.011000000000000001,N41520057167,usda-ndb-import,high protein bar,1582.0,8.89,,0,,Ahold Fitness High Protein Bar,40.0,45 g (1 BAR),0.233,15.56
Ahold,ahold,37.78,0.011000000000000001,N41520058508,usda-ndb-import,high protein bar,1582.0,8.89,2.2,0,,Ahold Fitness High Protein Bar,40.0,45 g (1 BAR),0.511,13.33
Blue Diamond Almonds,blue-diamond-almonds,16.28,0.0,N41570052006,usda-ndb-import,roasted salted almonds,2531.0,55.81,9.3,0,,Blue Diamond Almonds Roasted Salted Almonds,20.93,43 g (1 PACKAGE),0.302,4.65
"Better Made,  Better Made Snack Foods  Inc.","better-made,better-made-snack-foods-inc",53.57,0.0,N41633001286,usda-ndb-import,potato chips original,2389.0,39.29,3.6,0,,"Better Made Special, Potato Chips, Original",7.14,28 g (28 g),0.607,0.0
"Better Made,  Better Made Snack Foods  Inc.","better-made,better-made-snack-foods-inc",57.14,0.0,N41633063024,usda-ndb-import,potato chips original,2243.0,32.14,3.6,0,,"Better Made Special Lightly Salted Potato Chips, Original",7.14,28 g (22 CHIPS),0.304,0.0
"Price Chopper,  Price Chopper Supermarkets","price-chopper,price-chopper-supermarkets",42.86,0.018000000000000002,N41735090942,usda-ndb-import,popcorn white cheddar,2389.0,39.29,7.1,0,,"Price Chopper Pics, Flavored Popcorn, White Cheddar",10.71,28 g (2 1/4 CUPS),1.179,7.14
Utz,utz,50.0,0.0,N41780000286,usda-ndb-import,chips salt vinegar,2243.0,32.14,3.6,0,,"Utz Potato Chips, Salt'N Vinegar",7.14,28 g (1 oz),0.9640000000000001,3.57
Utz,utz,50.0,0.0,N41780000484,usda-ndb-import,style potato chips,2243.0,32.14,3.6,0,,"Utz Carolina Style Potato Chips, Barbeque",7.14,28 g (1 oz),0.9640000000000001,3.57
Utz,utz,50.0,0.0,N41780020277,usda-ndb-import,chips salt vinegar,2243.0,32.14,3.6,0,,"Utz Potato Chips, Salt'N Vinegar",7.14,28 g (1 oz),0.9640000000000001,3.57
"Utz,  Utz Quality Foods  Inc.","utz,utz-quality-foods-inc",50.0,0.0,N41780044914,usda-ndb-import,potato chips original,2243.0,35.71,3.6,0,,"Utz Ripples Potato Chips, Original",7.14,28 g (20 CHIPS | ABOUT),0.33899999999999997,0.0
Maruchan,maruchan,60.94,0.016,N41789001055,usda-ndb-import,noodles with vegetables,1895.0,18.75,3.1,0,,"Maruchan Instant Lunch, Ramen Noodles With Vegetables And Shrimp, Lime",10.94,64 g (64 g),1.875,3.12
"Maruchan,  Maruchan  Inc.","maruchan,maruchan-inc",60.94,0.016,N41789001154,usda-ndb-import,noodles with vegetables,1895.0,17.19,3.1,0,,"Maruchan Instant Lunch, Ramen Noodles With Vegetables, Lime Chili",10.94,64 g (64 g),1.828,3.12
"Maruchan,  Maruchan  Inc.","maruchan,maruchan-inc",60.94,0.016,N41789001253,usda-ndb-import,noodles with vegetables,1895.0,18.75,3.1,0,,"Maruchan Instant Lunch, Ramen Noodles With Vegetables, Shrimp",10.94,64 g (64 g),1.75,3.12
Maruchan,maruchan,60.94,0.016,N41789001284,usda-ndb-import,noodles with vegetables,1895.0,18.75,3.1,0,,"Maruchan Instant Lunch, Ramen Noodles With Vegetables, Chili Piquin & Shrimp",10.94,64 g (64 g),0.002,3.12
Maruchan,maruchan,60.94,0.0,N41789001314,usda-ndb-import,noodles with vegetables,1895.0,18.75,3.1,0,,"Maruchan Instant Lunch, Ramen Noodles With Vegetables, Chicken",10.94,64 g (1 cup),0.002,3.12
"Maruchan,  Maruchan  Inc.","maruchan,maruchan-inc",60.94,0.0,N41789001437,usda-ndb-import,noodles with vegetables,1895.0,17.19,3.1,0,,"Maruchan Instant Lunch, Ramen Noodles With Vegetables, Hot & Spicy Chicken",10.94,64 g (64 g),2.0469999999999997,4.69
"Maruchan,  Maruchan  Inc.","maruchan,maruchan-inc",60.94,0.0,N41789001581,usda-ndb-import,noodles with vegetables,1895.0,18.75,3.1,0,,"Maruchan Instant Lunch, Ramen Noodles With Vegetables",10.94,64 g (1 CONTAINER),2.0,3.12
"Maruchan,  Maruchan  Inc.","maruchan,maruchan-inc",59.02,0.0,N41789001727,usda-ndb-import,noodles with vegetables,1920.0,19.67,3.3,0,,"Maruchan Ramen Noodles With Vegetables, Beef",11.48,61 g (1 CONTAINER),1.197,4.92
"Maruchan,  Maruchan  Inc.","maruchan,maruchan-inc",58.14,0.0,N41789002137,usda-ndb-import,ramen noodle soup,1849.0,16.28,2.3,0,,"Maruchan Ramen Noodle Soup, Pork",11.63,43 g (0.5 BLOCK OF NOODLES WITH SEASONING),2.233,2.33
"Maruchan,  Maruchan  Inc.","maruchan,maruchan-inc",60.47,0.0,N41789002465,usda-ndb-import,ramen noodle soup,1849.0,16.28,2.3,0,,"Maruchan Ramen Noodle Soup, Chicken Mushroom",11.63,43 g (43 g),1.953,2.33
"Maruchan,  Maruchan  Inc.","maruchan,maruchan-inc",53.08,0.0,N41789003028,usda-ndb-import,noodles with vegetables,1686.0,16.99,2.1,0,,"Maruchan Bowl Ramen Noodles With Vegetables, Hot & Spicy Chicken",8.49,47.1 g (47.1 g),1.656,6.37
"Maruchan,  Maruchan  Inc.","maruchan,maruchan-inc",52.97,0.011000000000000001,N41789003035,usda-ndb-import,noodles with vegetables,1686.0,16.95,4.2,0,,"Maruchan Bowl Ramen Noodles With Vegetables, Hot & Spicy With Shrimp",8.47,47.2 g (47.2 g),1.695,4.24
Maruchan,maruchan,58.58,0.0,N41789003516,usda-ndb-import,ramen noodle soup,2013.0,23.01,2.1,0,,Maruchan Ramen Noodle Soup,10.46,47.8 g (0.5 CONTAINER),1.9669999999999999,2.09
Great American,great-american,5.31,0.006,N41820810394,usda-ndb-import,chicken noodle soup,155.0,1.02,0.4,0,,Great American Chunky Chicken Noodle Soup,2.04,245 g (1 cup),0.363,0.82
Dean's,dean-s,22.06,0.037000000000000005,N41900021405,usda-ndb-import,premium ice cream,983.0,14.71,0.0,0,,"Dean's Country Fresh, Premium Ice Cream, Butter Pecan",2.94,68 g (0.5 cup),0.14,16.18
Dean's,dean-s,29.41,0.037000000000000005,N41900047719,usda-ndb-import,chocolate chip cookie,983.0,11.76,0.0,0,,"Dean's Country Fresh, Premium Ice Cream, Chocolate Chip Cookie Dough",2.94,68 g (0.5 cup),0.096,20.59
Trumoo,trumoo,44.78,0.006999999999999999,N41900077617,usda-ndb-import,ice cream sandwiches,937.0,4.48,1.5,0,,Trumoo Chocolate Lowfat Ice Cream Sandwiches,5.97,67 g (67 g),0.239,26.87
Best Yet,best-yet,27.06,0.0,N42187199979,usda-ndb-import,french fried potatoes,736.0,7.06,2.4,0,,Best Yet French Fried Potatoes,2.35,85 g (24 PIECES | ABOUT),0.365,0.0
"Best Yet,  S. M. Flickinger Co.  Inc.","best-yet,s-m-flickinger-co-inc",57.14,0.0,N42187426822,usda-ndb-import,chips salt vinegar,2243.0,32.14,3.6,0,,"Best Yet Potato Chips, Salt & Vinegar",7.14,28 g (17 CHIPS | ABOUT),0.9640000000000001,7.14
Jennie-O Turkey Store  Inc.,jennie-o-turkey-store-inc,1.79,0.045,N42222824446,usda-ndb-import,smoked turkey breast,372.0,1.79,0.0,0,,"Jennie-O Turkey Store  Inc. Lipari Oldtyme, Hickory Smoked Turkey Breast With Natural Smoke Flavor",19.64,56 g (2 ONZ),0.857,1.79
"Jennie-O,  Jennie-O Turkey Store  Inc.","jennie-o,jennie-o-turkey-store-inc",0.0,0.036000000000000004,N42222831741,usda-ndb-import,roasted turkey breast,372.0,0.89,0.0,0,,Jennie-O Oven Roasted Turkey Breast,19.64,56 g (2 ONZ),0.46399999999999997,0.0
"Jennie-O,  Jennie-O Turkey Store  Inc.","jennie-o,jennie-o-turkey-store-inc",0.0,0.045,N42222850520,usda-ndb-import,roasted turkey breast,372.0,1.79,0.0,0,,Jennie-O Pan Roasted Turkey Breast,19.64,56 g (2 ONZ),0.696,0.0
Jennie-O Turkey Store  Inc.,jennie-o-turkey-store-inc,1.79,0.036000000000000004,N42222853934,usda-ndb-import,roasted turkey breast,372.0,0.89,0.0,0,,"Jennie-O Turkey Store  Inc. Lipari Oldtyme, Roasted Turkey Breast",17.86,56 g (2 ONZ),0.821,1.79
Malt O Meal,malt-o-meal,86.67,0.0,N42400064855,usda-ndb-import,corn puff cereal,1674.0,3.33,3.3,0,,"Malt O Meal Chocolate Marshmallow Mateys, Sweetened Corn Puff Cereal With Real Cocoa & Marshmallows",3.33,30 g (0.75 cup),0.36700000000000005,56.67
Mom Brands,mom-brands,86.67,0.0,N42400108030,usda-ndb-import,corn puff cereal,1674.0,5.0,3.3,0,,"Mom Brands Coco Roos, Sweetened Corn Puff Cereal With Real Cocoa",3.33,30 g (0.75 cup),0.36700000000000005,46.67
Coco Roos,coco-roos,86.67,0.0,N42400181668,usda-ndb-import,corn puff cereal,1674.0,5.0,3.3,0,,Coco Roos Naturally & Artificially Flavored Sweetened Corn Puff Cereal With Real Cocoa,3.33,30 g (0.75 cup),0.36700000000000005,46.67
"Malt O Meal,  Malt O Meal S'Mores","malt-o-meal,malt-o-meal-s-mores",80.0,0.0,N42400218371,usda-ndb-import,corn puff cereal,1674.0,8.33,3.3,0,,"Malt O Meal S'Mores, Honey Graham Squares & Cocoa Corn Puff Cereal With Marshmallows",3.33,30 g (0.75 cup),0.7,40.0
Mom's Best Cereals,mom-s-best-cereals,90.0,0.0,N42400220428,usda-ndb-import,corn puff cereal,1674.0,3.33,3.3,0,,"Mom's Best Cereals Sweetened Corn Puff Cereal, Cocoa Marshmallow Safari",3.33,30 g (0.75 cup),0.28300000000000003,53.33
Coco Roos,coco-roos,86.67,0.0,N42400221166,usda-ndb-import,corn puff cereal,1674.0,5.0,3.3,0,,Coco Roos Naturally & Artificially Flavored Sweetened Corn Puff Cereal With Real Cocoa,3.33,30 g (0.75 cup),0.36700000000000005,46.67
Malt O Meal,malt-o-meal,86.67,0.0,N42400223580,usda-ndb-import,corn puff cereal,1674.0,3.33,3.3,0,,Malt O Meal Sweetened Corn Puff Cereal With Real Cocoa And Marshmallows,3.33,30 g (0.75 cup),0.36700000000000005,56.67
Malt O Meal,malt-o-meal,76.67,0.0,N42400227762,usda-ndb-import,corn puff cereal,1812.0,13.33,3.3,0,,"Malt O Meal Peanut Butter Cups, Sweetened Corn Puff Cereal With Real Peanut Butter & Cocoa",6.67,30 g (0.75 cup),0.41700000000000004,43.33
"Malt O Meal,  Mom Brands","malt-o-meal,mom-brands",80.0,0.0,N42400231271,usda-ndb-import,corn puff cereal,1674.0,8.33,3.3,0,,"Malt O Meal S'Mores, Honey Graham Squares & Cocoa Corn Puff Cereal With Marshmallows",3.33,30 g (0.75 cup),0.7,40.0
Mom Brands,mom-brands,86.67,0.0,N42400237518,usda-ndb-import,corn puff cereal,1674.0,3.33,3.3,0,,Mom Brands Cocoa Corn Puff Cereal,3.33,30 g (0.75 cup),0.3,53.33
Field Day,field-day,10.4,0.0,N42563600341,usda-ndb-import,organic pasta sauce,234.0,0.8,1.6,0,,"Field Day Organic Pasta Sauce, Roasted Garlic",1.6,125 g (0.5 cup),0.392,6.4
Field Day,field-day,9.6,0.0,N42563600358,usda-ndb-import,organic pasta sauce,201.0,0.8,1.6,0,,"Field Day Organic Pasta Sauce, Traditional Marinara",1.6,125 g (0.5 cup),0.41600000000000004,6.4
"Field Day,  United Natural Foods  Inc.","field-day,united-natural-foods-inc",9.6,0.0,N42563603021,usda-ndb-import,organic pasta sauce,201.0,0.8,1.6,0,,"Field Day Organic Pasta Sauce, Garden Vegetables",0.8,125 g (0.5 cup),0.43200000000000005,6.4
United Natural Foods  Inc.,united-natural-foods-inc,45.0,0.0,N42563603281,usda-ndb-import,fruit nut bar,1987.0,30.0,7.5,0,,United Natural Foods  Inc. Cashew Chia Fruit & Nut Bar,12.5,40 g (1 BAR),0.0,20.0
Cumberland Farms Dairy Inc,cumberland-farms-dairy-inc,58.7,0.005,N42704044737,usda-ndb-import,dark chocolate bar,2046.0,33.7,5.4,0,,Cumberland Farms Dairy Inc Dark Chocolate Bar,4.35,92 g (1 BAR),0.071,45.65
Country Dairy,country-dairy,20.0,0.062,N44041012240,usda-ndb-import,chocolate ice cream,967.0,15.38,0.0,0,,"Country Dairy Dutch Chocolate, Rich Chocolate Ice Cream, Dutch Chocolate",3.08,65 g (65 g),0.062,20.0
Hood,hood,27.27,0.038,N44100239762,usda-ndb-import,chocolate ice cream,887.0,9.09,1.5,0,,Hood Chocolate Ice Cream,4.55,66 g (0.5 cup),0.076,22.73
J.S. Krum Inc.,j-s-krum-inc,43.53,0.124,N44261430619,usda-ndb-import,peanut butter cup,2314.0,36.47,2.4,0,,"J.S. Krum Inc. Pearl River, Cheesecake, Mint, Peanut Butter Cup",11.76,85 g (85 GRM),0.294,34.12
Route 11 Potato Chips,route-11-potato-chips,57.14,0.0,N44935000421,usda-ndb-import,chips salt vinegar,2243.0,28.57,3.6,0,,"Route 11 Potato Chips Kettle Cooked Potato Chips, Salt & Vinegar",7.14,28 g (1 oz),0.643,3.57
The Bread Garden  Ltd.,the-bread-garden-ltd,53.12,0.0,N44962801527,usda-ndb-import,hot dog buns,1243.0,3.12,0.0,0,,"The Bread Garden  Ltd. Brenner Brothers, Gourmet Hot Dog Buns",9.38,64 g (0.25 oz),0.516,6.25
Shaw's,shaw-s,45.24,0.0,N45674340397,usda-ndb-import,whole grain bread,1197.0,7.14,11.9,0,,Shaw's Whole Grain Bread,11.9,42 g (1 SLICE),0.381,4.76
Raley's,raley-s,42.86,0.0,N46567027623,usda-ndb-import,popcorn white cheddar,2389.0,39.29,7.1,0,,"Raley's Popcorn, White Cheddar",7.14,28 g (1.5 cup),0.929,7.14
Raley's,raley-s,67.86,0.0,N46567029221,usda-ndb-import,potato chips original,1941.0,17.86,3.6,0,,"Raley's Kettle Potato Chips, Original",7.14,28 g (18 CHIPS | ABOUT),0.48200000000000004,7.14
Raley's,raley-s,8.0,0.0,N46567030128,usda-ndb-import,organic pasta sauce,335.0,5.6,2.4,0,,Raley's Organic Pasta Sauce,0.8,125 g (0.5 cup),0.23199999999999998,4.0
Raley's,raley-s,1.79,0.071,N46567030753,usda-ndb-import,albacore tuna in,523.0,1.79,0.0,0,,"Raley's Solid White Albacore, Tuna In Water",28.57,56 g (0.25 cup),0.39299999999999996,0.0
Trader Joe's,trader-joe-s,12.15,0.013999999999999999,N479363,usda-ndb-import,chili with beans,406.0,1.82,2.8,0,,Trader Joe's Turkey Chili With Beans,7.69,247 g (8.7 oz),0.324,2.43
Chicken Of The Sea,chicken-of-the-sea,3.57,0.062,N48000000781,usda-ndb-import,sardines in tomato,372.0,1.79,1.8,0,,"Chicken Of The Sea Sardines, In Tomato Sauce",14.29,56 g (2 oz),0.46399999999999997,1.79
"Chicken Of The Sea,  Chicken Of The Sea Intl.","chicken-of-the-sea,chicken-of-the-sea-intl",0.0,0.036000000000000004,N48000000958,usda-ndb-import,albacore tuna in,448.0,1.79,0.0,0,,Chicken Of The Sea Solid White Albacore Tuna In Water,23.21,56 g (2 oz),0.25,0.0
Chicken Of The Sea,chicken-of-the-sea,0.0,0.036000000000000004,N48000033550,usda-ndb-import,chunk white albacore,372.0,1.79,0.0,0,,Chicken Of The Sea Chunk White Albacore Tuna In Water,19.64,56 g (2 oz),0.25,0.0
Nice!,nice,46.51,0.0,N49022721227,usda-ndb-import,hot dog buns,1071.0,3.49,0.0,0,,Nice! Hot Dog Buns,9.3,43 g (1 BUN),0.442,4.65
Walgreens Co.,walgreens-co,72.0,0.0,N49022836266,usda-ndb-import,soft baked cookies,1674.0,12.0,0.0,0,,"Walgreens Co. Smile & Save, Oatmeal Raisin Soft Baked Cookies",4.0,25 g (1 COOKIE),0.34,36.0
Walgreens Co.,walgreens-co,60.0,0.0,N49022836280,usda-ndb-import,soft baked cookies,1841.0,20.0,4.0,0,,"Walgreens Co. Smile & Save, Soft Baked Cookies, Peanut Butter",8.0,25 g (1 COOKIES),0.38,28.0
Walgreens Co.,walgreens-co,72.0,0.0,N49022836303,usda-ndb-import,soft baked cookies,1841.0,16.0,0.0,0,,"Walgreens Co. Smile & Save, Sugar Soft Baked Cookies",4.0,25 g (1 COOKIE),0.48,32.0
Our Speciality,our-speciality,71.05,0.026000000000000002,N49800124486,usda-ndb-import,frosted sugar cookies,1870.0,15.79,0.0,0,,Our Speciality Frosted Sugar Cookies,5.26,38 g (1 COOKIE),0.25,44.74
Our Speciality,our-speciality,71.05,0.026000000000000002,N49800124554,usda-ndb-import,frosted sugar cookies,1870.0,15.79,0.0,0,,Our Speciality Frosted Sugar Cookies,5.26,38 g (1 COOKIE),0.25,44.74
Rich Products Corporation,rich-products-corporation,67.65,0.015,N49800132504,usda-ndb-import,oatmeal raisin cookies,2092.0,20.59,2.9,0,,"Rich Products Corporation Our Specialty, Oatmeal Raisin Cookies",5.88,34 g (1 COOKIE),0.441,32.35
Rich Products Corp,rich-products-corp,57.01,0.027999999999999997,N49800164253,usda-ndb-import,red velvet cake,1879.0,22.43,0.9,0,,Rich Products Corp Red Velvet Cake,4.67,107 g (1 SLICE),0.486,41.12
Earthgrains Baking Companies  Inc.,earthgrains-baking-companies-inc,53.49,0.0,N50400764040,usda-ndb-import,hot dog buns,1167.0,3.49,2.3,0,,"Earthgrains Baking Companies  Inc. Colonial, Hot Dog Buns, Honey",9.3,43 g (43 g),0.535,6.98
Gold Emblem Abound,gold-emblem-abound,21.43,0.0,N50428408049,usda-ndb-import,dry roasted peanuts,2389.0,50.0,7.1,0,,Gold Emblem Abound Unsalted Dry Roasted Peanuts,25.0,28 g (40 PIECES | ABOUT),0.0,3.57
Gold Emblem,gold-emblem,67.5,0.0,N50428479650,usda-ndb-import,greek style yogurt,1883.0,20.0,2.5,0,,Gold Emblem Greek Style Yogurt Coated Cranberries,5.0,40 g (0.25 cup),0.075,60.0
Gold Emblem,gold-emblem,28.57,0.0,N50428482063,usda-ndb-import,honey roasted peanuts,2389.0,45.24,7.1,0,,Gold Emblem Honey Roasted Peanuts,23.81,42 g (1 PACKAGE),0.298,19.05
Gold Emlem Select,gold-emlem-select,65.62,0.031,N50428484005,usda-ndb-import,chocolate chunk cookies,1962.0,21.88,3.1,0,,Gold Emlem Select Soft Baked Chocolate Chunk Cookies,3.12,32 g (2 COOKIES),0.43799999999999994,37.5
Gold Emblem,gold-emblem,72.5,0.0,N50428557648,usda-ndb-import,chocolate covered pretzels,1987.0,17.5,2.5,0,,Gold Emblem Milk Chocolate Covered Pretzels,5.0,40 g (8 PIECES | ABOUT),0.312,40.0
Klosterman,klosterman,48.89,0.0,N51721002286,usda-ndb-import,hot dog buns,1117.0,3.33,2.2,0,,Klosterman Honey Hot Dog Buns,8.89,45 g (1 BUN),0.444,4.44
Land O'Frost,land-o-frost,5.36,0.054000000000000006,N51900020025,usda-ndb-import,roasted turkey breast,523.0,0.89,,0,,Land O'Frost Honey Roasted Turkey Breast,23.21,56 g (2 oz),0.679,3.57
Kaskey's,kaskey-s,8.0,0.0,N51933034402,usda-ndb-import,mushroom condensed soup,335.0,4.8,1.6,0,,Kaskey's Cream Of Mushroom Condensed Soup,1.6,125 g (0.5 cup),0.64,0.8
Kaskey's,kaskey-s,8.0,0.008,N51933034501,usda-ndb-import,chicken condensed soup,402.0,6.4,0.8,0,,Kaskey's Cream Of Chicken Condensed Soup,2.4,125 g (0.5 cup),0.64,0.8
The Moran Group Incorporated,the-moran-group-incorporated,50.0,0.0,N51933051324,usda-ndb-import,honey roasted peanuts,2092.0,32.14,3.6,0,,"The Moran Group Incorporated J. Higgs, Honey Roasted Peanuts",14.29,28 g (1 ONZ),0.125,39.29
Hargis House,hargis-house,9.32,0.032,N51933102903,usda-ndb-import,corned beef hash,728.0,10.59,0.8,0,,Hargis House Corned Beef Hash,9.32,236 g (1 cup),0.419,0.42
Kaskey's,kaskey-s,5.31,0.008,N51933129559,usda-ndb-import,chicken noodle soup,172.0,0.82,0.4,0,,Kaskey's Chunky Chicken Noodle Soup,2.86,245 g (1 cup),0.196,0.82
So-Cheezy,so-cheezy,74.29,0.0,N51933340770,usda-ndb-import,macaroni cheese dinner,1494.0,1.43,2.9,0,,So-Cheezy Dinosaurs & Cheese Macaroni & Cheese Dinner,11.43,70 g (0.5 BOX | ABOUT),0.871,4.29
7-Eleven  Inc.,7-eleven-inc,45.24,0.012,N52548566302,usda-ndb-import,peanut butter cup,2489.0,40.48,4.8,0,,7-Eleven  Inc. Colossal Peanut Butter Cup,11.9,42 g (0.5 PEANUT BUTTER CUP),0.11900000000000001,38.1
Pacific,pacific,7.58,0.011000000000000001,N52603054690,usda-ndb-import,chicken condensed soup,285.0,2.65,0.0,0,,Pacific Organic Cream Of Chicken Condensed Soup,3.03,132 g (0.5 cup),0.644,0.0
Pacific,pacific,4.92,0.006,N52603054942,usda-ndb-import,chicken noodle soup,138.0,0.61,0.4,0,,Pacific Organic Chicken Noodle Soup,2.05,244 g (1 cup),0.18899999999999997,0.41
Pacific,pacific,18.25,0.0,N52603094795,usda-ndb-import,refried black beans,431.0,1.19,5.6,0,,Pacific Refried Black Beans Vegetarian,5.56,126 g (0.5 cup),0.23800000000000002,3.97
Pacific,pacific,3.57,0.054000000000000006,N52603094917,usda-ndb-import,salsa con queso,749.0,14.29,0.0,0,,"Pacific Salsa Con Queso, Medium",7.14,28 g (2 Tbsp),0.679,0.0
Fannie May,fannie-may,48.84,0.0,N52745728381,usda-ndb-import,dark chocolate bar,2042.0,39.53,9.3,0,,"Fannie May 70% Dark Chocolate Bar, Sea Salt",6.98,43 g (43 g),0.37200000000000005,30.23
Hartford House,hartford-house,9.32,0.032,N54100041067,usda-ndb-import,corned beef hash,745.0,11.02,0.8,0,,Hartford House Corned Beef Hash,9.32,236 g (1 cup),0.415,0.42
Dr. Oetker,dr-oetker,23.89,0.027000000000000003,N58336180071,usda-ndb-import,thin crust pizza,1109.0,14.16,1.8,0,,"Dr. Oetker Pizza Quattro Formaggi, Thin Crust Pizza With Mozzarella, Edam, Emmental, Blue Cheese",10.62,113 g (113 g),0.442,1.77
Yummy,yummy,19.74,0.026000000000000002,N64563226536,usda-ndb-import,chicken breast nuggets,937.0,11.84,1.3,0,,Yummy Dino Buddies Chicken Breast Nuggets,10.53,76 g (4 PIECES),0.48700000000000004,0.0
Yummy,yummy,19.74,0.026000000000000002,N64563226574,usda-ndb-import,chicken breast nuggets,937.0,11.84,1.3,0,,Yummy Dino Buddies Chicken Breast Nuggets,10.53,76 g (4 PIECES),0.48700000000000004,0.0
Voortman,voortman,63.16,0.0,N67312002153,usda-ndb-import,oatmeal raisin cookies,1761.0,15.79,5.3,0,,Voortman Oatmeal Raisin Cookies,5.26,19 g (19 g),0.474,26.32
Que Pasa,que-pasa,64.29,0.0,N68826060127,usda-ndb-import,white corn tortilla,2092.0,25.0,7.1,0,,Que Pasa Organic White Corn Tortilla Chips,7.14,28 g (28 g),0.179,0.0
Always Save,always-save,7.2,0.0,N70038343653,usda-ndb-import,mushroom condensed soup,234.0,2.4,0.8,0,,Always Save Cream Of Mushroom Condensed Soup,1.6,125 g (0.5 cup),0.664,0.0
Clearly Organic,clearly-organic,6.53,0.002,N70038639145,usda-ndb-import,tomato basil soup,155.0,0.82,0.8,0,,Clearly Organic Organic Tomato Basil Soup,0.82,245 g (1 cup),0.257,3.67
"Marzetti,  T. Marzetti Company","marzetti,t-marzetti-company",16.67,0.05,N70200500228,usda-ndb-import,thousand island dressing,2092.0,50.0,0.0,0,,Marzetti Thousand Island Dressing,0.0,30 g (2 Tbsp),0.833,13.33
