"Uncle Ray's,  Uncle Rays  Llc","uncle-ray-s,uncle-rays-llc",53.57,0.0,N614156062098,usda-ndb-import,chips salt vinegar,2389.0,35.71,3.6,0,,"Uncle Ray's Potato Chips, Salt & Vinegar",7.14,28 g (12 CHIPS | ABOUT),1.786,3.57
"Uncle Ray's,  Uncle Rays  Llc","uncle-ray-s,uncle-rays-llc",57.14,0.0,N614156062128,usda-ndb-import,potato chips cheddar,2389.0,35.71,3.6,0,,"Uncle Ray's Beyond Good!, Potato Chips, Cheddar",7.14,28 g (12 CHIPS | ABOUT),1.036,3.57
Sun Maid,sun-maid,71.79,0.013000000000000001,N629014610878,usda-ndb-import,oatmeal raisin cookies,1715.0,11.54,2.6,0,,Sun Maid Oatmeal Raisin Cookies,5.13,39 g (1 COOKIE),0.321,38.46
Create A Treat,create-a-treat,67.44,0.012,N629014630746,usda-ndb-import,frosted sugar cookies,1753.0,16.28,2.3,0,,Create A Treat Frosted Sugar Cookies,4.65,43 g (1 COOKIE),0.27899999999999997,44.19
Create A Treat,create-a-treat,67.44,0.023,N629014630821,usda-ndb-import,frosted sugar cookies,1753.0,16.28,2.3,0,,Create A Treat Frosted Sugar Cookies,4.65,43 g (1 COOKIE),0.18600000000000003,41.86
Bela,bela,0.0,0.045,N633600502324,usda-ndb-import,sardines in tomato,912.0,16.36,0.0,0,,Bela Lightly Smoked Portuguese Sardines In Tomato Sauce,20.0,55 g (0.25 cup),0.245,0.0
West Liberty Foods,west-liberty-foods,3.57,0.045,N633920608805,usda-ndb-import,roasted turkey breast,448.0,1.79,0.0,0,,West Liberty Foods Slow Roasted Turkey Breast,19.64,56 g (2 oz),0.768,1.79
"Atkins,  Atkins Nutritionals  Inc.","atkins,atkins-nutritionals-inc",52.94,0.0,N637480077057,usda-ndb-import,peanut butter cups,1971.0,38.24,11.8,0,,"Atkins Endulge, Peanut Butter Cups",5.88,34 g (34 g),0.324,0.0
Supreme Protein,supreme-protein,37.5,0.036000000000000004,N639372025023,usda-ndb-import,high protein bar,1699.0,15.62,2.1,0,,"Supreme Protein High Protein Bar, Caramel Nut Chocolate",31.25,96 g (96 g),0.22899999999999998,8.33
Premier Protein,premier-protein,34.72,0.0,N643843000471,usda-ndb-import,high protein bar,1686.0,11.11,4.2,0,,"Premier Protein Gluten Free High Protein Bar, Chocolate, Peanut Butter",41.67,72 g (72 g),0.611,11.11
Duncan Hines,duncan-hines,84.91,0.0,N644209404155,usda-ndb-import,red velvet cake,1657.0,6.6,1.9,0,,"Duncan Hines Perfect Size, Red Velvet Cake Mix & Cream Cheese Frosting Mix",1.89,53 g (53 g),0.396,64.15
Oregon Harvest  Llc,oregon-harvest-llc,20.0,0.0,N645136000540,usda-ndb-import,red pepper hummus,837.0,10.0,6.7,0,,Oregon Harvest  Llc Roasted Red Pepper Hummus,6.67,30 g (2 Tbsp),0.35,3.33
Bar-S Foods Co.,bar-s-foods-co,6.25,0.031,N645230011336,usda-ndb-import,smoked turkey breast,523.0,4.69,0.0,0,,Bar-S Foods Co. Smoked Turkey Breast And White Turkey,15.62,32 g (1 SLICE),0.7809999999999999,3.12
Z-Best,z-best,54.05,0.0,N650912101809,usda-ndb-import,whole grain bread,1130.0,0.0,2.7,0,,Z-Best Whole Grain Bread,10.81,37 g (1 SLICE),0.838,0.0
Lamontagne Chocolate Inc.,lamontagne-chocolate-inc,56.14,0.0,N663936772245,usda-ndb-import,dark chocolate almonds,2054.0,33.33,8.8,0,,"Lamontagne Chocolate Inc. Lamontagne, Dark Chocolate Almonds",7.02,57 g (1 BAG),0.035,43.86
Enjou Chocolat Of Morristown  Inc.,enjou-chocolat-of-morristown-inc,50.0,0.0,N666140102563,usda-ndb-import,dark chocolate almonds,2301.0,37.5,7.5,0,,"Enjou Chocolat Of Morristown  Inc. Enjou Chocolae, Dark Chocolate Almonds",10.0,40 g (1 PIECE),0.0,40.0
Prairie Grove Farms,prairie-grove-farms,2.38,0.065,N675571879319,usda-ndb-import,sweet italian sausage,1197.0,22.62,0.0,0,,Prairie Grove Farms Sweet Italian Sausage,16.67,84 g (84 g),0.631,1.19
Organico Bello,organico-bello,4.42,0.0,N677294998025,usda-ndb-import,marinara pasta sauce,130.0,1.33,0.9,0,,Organico Bello Organic Marinara Pasta Sauce,0.88,113 g (0.5 cup),0.204,1.77
Organico Bello,organico-bello,4.42,0.0,N677294998032,usda-ndb-import,organic pasta sauce,130.0,1.33,0.9,0,,Organico Bello Organic Pasta Sauce,0.88,113 g (0.5 cup),0.204,1.77
Organico Bello,organico-bello,4.42,0.0,N677294998049,usda-ndb-import,organic pasta sauce,130.0,1.33,0.9,0,,Organico Bello Organic Pasta Sauce,0.88,113 g (0.5 cup),0.204,1.77
Wal-Mart Stores  Inc.,wal-mart-stores-inc,69.05,0.024,N681131098960,usda-ndb-import,oatmeal raisin cookies,1992.0,19.05,2.4,0,,Wal-Mart Stores  Inc. Ultimate Oatmeal Raisin Cookies,4.76,42 g (42 GRM),0.27399999999999997,40.48
"Marketside,  Wal-Mart Stores  Inc.","marketside,wal-mart-stores-inc",64.71,0.059000000000000004,N681131122689,usda-ndb-import,cookies chocolate chip,1971.0,23.53,5.9,0,,"Marketside Cookies, Chocolate Chip",5.88,17 g (1 COOKIE),0.588,47.06
"Marketside,  Wal-Mart Stores  Inc.","marketside,wal-mart-stores-inc",45.78,0.084,N681131124591,usda-ndb-import,red velvet cake,1615.0,21.08,0.6,0,,Marketside Exquisite Red Velvet Cake By The Slice,4.22,166 g (1 SLICE),0.096,34.34
Zap Studio,zap-studio,15.25,0.0,N685248987643,usda-ndb-import,dairy frozen dessert,707.0,11.02,2.5,0,,"Zap Studio New Barn, Almond Creme, Non-Dairy Frozen Dessert, Organic Chocolate",4.24,118 ml (0.5 cup),0.013000000000000001,11.86
Ahold,ahold,53.54,0.0,N688267012495,usda-ndb-import,cinnamon rolls with,1393.0,11.11,1.0,0,,Ahold Jumbo Cinnamon Rolls With Cream Cheese Icing,4.04,99 g (1 ROLL WITH ICING),0.6970000000000001,25.25
Ahold,ahold,44.19,0.0,N688267052293,usda-ndb-import,whole grain bread,975.0,3.49,9.3,0,,"Ahold Nature's Promise, Whole 9 Grain Bread",11.63,43 g (43 g),0.37200000000000005,4.65
Giant,giant,66.67,,N688267062933,usda-ndb-import,chicken gravy mix,1393.0,8.33,,0,,Giant Chicken Gravy Mix,0.0,6 g (2 tsp),5.167000000000001,16.67
Giant,giant,52.27,,N688267076305,usda-ndb-import,cinnamon rolls with,1427.0,11.36,2.3,0,,Giant Cinnamon Rolls With Icing,4.55,44 g (44 g),0.682,25.0
Giant,giant,53.57,0.0,N688267119705,usda-ndb-import,classic potato chips,2243.0,32.14,3.6,0,,Giant Classic Potato Chips,7.14,28 g (15 CHIPS | ABOUT),0.48200000000000004,3.57
Ahold,ahold,60.0,0.0,N688267145636,usda-ndb-import,baked snack crackers,1674.0,16.67,3.3,0,,Ahold Cheddar Penguins Made With Whole Grains Baked Snack Crackers,6.67,30 g (52 CRACKERS),0.6,3.33
Ahold,ahold,5.71,0.01,N688267156045,usda-ndb-import,chicken noodle soup,172.0,1.02,0.4,0,,Ahold Chicken Noodle Soup,2.86,245 g (1 cup),0.282,0.41
"Hammond's,  Hammond's Candies Since 1920  Llc","hammond-s,hammond-s-candies-since-1920-llc",53.12,0.023,N691355893241,usda-ndb-import,red velvet cake,2025.0,26.56,1.6,0,,Hammond's Red Velvet Cake,6.25,64 g (64 GRM),0.125,45.31
Lifestyle Evolution Inc.,lifestyle-evolution-inc,40.0,0.0,N691535207011,usda-ndb-import,crunchy peanut butter,1674.0,15.56,15.6,0,,"Lifestyle Evolution Inc. Nugo, Slim, Crunchy Peanut Butter Protein Bar",37.78,45 g (45 g),0.17800000000000002,6.67
Topo-Logic Systems  Inc.,topo-logic-systems-inc,53.57,0.0,N696859091230,usda-ndb-import,potato chips original,3289.0,28.57,3.6,0,,"Topo-Logic Systems  Inc. Doctor Dread's, Famous Jamaican Jerk Kettle Cooked Potato Chips, Original",7.14,28 g (18 CHIPS | ABOUT),0.607,3.57
"Udi's,  Udi's Gluten Free","udi-s,udi-s-gluten-free",61.54,0.019,N698997807551,usda-ndb-import,soft baked cookies,1611.0,23.08,0.0,0,,"Udi's Gluten Free, Soft-Baked Cookies, Maple Pecan Chocolate Chip",3.85,26 g (26 g),0.25,30.77
"Udi's,  Udi's Gluten Free","udi-s,udi-s-gluten-free",47.54,0.0,N698997809302,usda-ndb-import,whole grain bread,1167.0,8.2,3.3,0,,"Udi's Gluten Free, Soft & Hearty Whole Grain Bread",8.2,61 g (61 g),0.59,4.92
"Udi's,  Pinnacle Foods Group Llc","udi-s,pinnacle-foods-group-llc",47.44,0.0,N698997810001,usda-ndb-import,whole grain bread,1180.0,7.69,2.6,0,,Udi's Whole Grain Bread,7.69,78 g (2 SLICES),0.5770000000000001,5.13
Three Rivers Confections  Llc,three-rivers-confections-llc,60.53,0.026000000000000002,N705772635589,usda-ndb-import,peanut butter cup,1761.0,15.79,2.6,0,,"Three Rivers Confections  Llc Fudgie Wudgie, Peanut Butter Cup Fudge",5.26,38 g (1.34 ONZ),0.25,55.26
Diestel Turkey Ranch,diestel-turkey-ranch,0.0,0.036000000000000004,N707330379331,usda-ndb-import,roasted turkey breast,448.0,0.89,,0,,Diestel Turkey Ranch Peppered Roasted Turkey Breast,25.0,56 g (2 oz),0.5,
Beverages & More  Inc.,beverages-more-inc,17.86,0.0,N707492082940,usda-ndb-import,honey roasted peanuts,2389.0,46.43,7.1,0,,"Beverages & More  Inc. Main & Geary, Bbq Honey Roasted Peanuts",25.0,28 g (0.25 CUP | ABOUT),0.304,7.14
Tops,tops,44.07,0.025,N7078404962,usda-ndb-import,ice cream sandwich,1134.0,8.47,0.0,0,,Tops Ice Cream Sandwich,3.39,59 g (1 SANDWICH),0.16899999999999998,27.12
"Boulder Canyon,  Inventure Foods  Inc.","boulder-canyon,inventure-foods-inc",64.29,0.0,N708163121111,usda-ndb-import,sweet potato chips,2389.0,39.29,10.7,0,,"Boulder Canyon Authentic Foods, Sweet Potato Chips",3.57,28 g (14 CHIPS) | (ABOUT),0.33899999999999997,14.29
"Boulder Canyon,  Inventure Foods  Inc.","boulder-canyon,inventure-foods-inc",64.29,0.0,N708163124440,usda-ndb-import,sweet potato chips,2389.0,39.29,10.7,0,,"Boulder Canyon Sweet Potato Chips, Sea Salt",3.57,28 g (14 CHIPS | ABOUT),0.33899999999999997,14.29
"K&G,  Krause Gentle Corporation","k-g,krause-gentle-corporation",53.57,0.0,N708615006089,usda-ndb-import,potato chips cheddar,2243.0,35.71,3.6,0,,"K&G Ripple Potato Chips, Cheddar & Sour Cream",7.14,28 g (22 CHIPS),0.679,7.14
Meijer,meijer,26.19,0.0,N708820304932,usda-ndb-import,french fried potatoes,699.0,5.95,2.4,0,,Meijer Extra Crispy Crinkle Cut French Fried Potatoes,2.38,84 g (3 oz),0.46399999999999997,1.19
Meijer,meijer,7.32,0.004,N708820544024,usda-ndb-import,chicken condensed soup,238.0,2.03,0.0,0,,Meijer Healthy Cream Of Chicken Condensed Soup,2.44,123 g (0.5 cup),0.33299999999999996,0.0
Purple Cow,purple-cow,32.35,0.037000000000000005,N708820697270,usda-ndb-import,premium ice cream,1167.0,16.18,1.5,0,,"Purple Cow Premium Ice Cream, Denali Extreme Moose Tracks",2.94,68 g (0.5 cup),0.08800000000000001,23.53
Meijer,meijer,62.5,0.012,N708820989177,usda-ndb-import,greek style yogurt,1987.0,20.0,0.0,0,,Meijer Greek Style Yogurt Coated Raisins,10.0,40 g (40 g),0.05,57.5
Meijer  Inc.,meijer-inc,70.0,0.0,N708820989191,usda-ndb-import,greek style yogurt,1987.0,20.0,2.5,0,,Meijer  Inc. Strawberry Greek Style Yogurt Coated Pretzels,7.5,40 g (8 PCS),0.25,40.0
Lofthouse Cookies,lofthouse-cookies,65.79,0.026000000000000002,N708971916794,usda-ndb-import,frosted sugar cookies,1761.0,15.79,0.0,0,,Lofthouse Cookies Frosted Sugar Cookies,2.63,38 g (38 g),0.276,42.11
"Lofthouse,  Lofthouse Foods","lofthouse,lofthouse-foods",65.79,0.026000000000000002,N708971926595,usda-ndb-import,frosted sugar cookies,1761.0,15.79,0.0,0,,"Lofthouse Making Every Day Festive, Frosted Sugar Cookies",2.63,38 g (1 COOKIE),0.276,42.11
Gefen,gefen,0.0,0.054000000000000006,N710069113602,usda-ndb-import,chunk light tuna,448.0,0.89,,0,,Gefen Chunk Light Tuna In Water,23.21,56 g (2 oz),0.446,
Stonewall Kitchen,stonewall-kitchen,73.68,0.0,N711381325964,usda-ndb-import,pancake waffle mix,1431.0,1.32,5.3,0,,Stonewall Kitchen Pancake & Waffle Mix,10.53,38 g (3 Tbsp),0.9740000000000001,21.05
Star Markets Co.,star-markets-co,67.5,0.0,N711535507932,usda-ndb-import,instant hot cereal,1464.0,7.5,10.0,0,,Star Markets Co. Organic Multigrain With Flax Instant Hot Cereal,12.5,40 g (1 PACKET),0.0,0.0
"Aunt Millie's,  Aunt Millie's Bakeries","aunt-millie-s,aunt-millie-s-bakeries",43.18,0.0,N7131405881,usda-ndb-import,hot dog buns,761.0,2.27,9.1,0,,"Aunt Millie's Hearth Hot Dog Buns, Whole Grain",9.09,44 g (44 g),0.307,4.55
Meijer,meijer,25.0,0.0,N713733141918,usda-ndb-import,crunchy peanut butter,2351.0,46.88,6.2,0,,"Meijer Crunchy Peanut Butter, Fresh Roasted",21.88,32 g (2 Tbsp),0.312,9.38
"Meijer,  Meijer  Inc.","meijer,meijer-inc",53.57,0.0,N713733198998,usda-ndb-import,classic potato chips,2243.0,35.71,3.6,0,,"Meijer Classic Potato Chips, Italian Sausage",7.14,28 g (24 CHIPS | ABOUT),0.75,7.14
Meijer,meijer,67.5,0.012,N713733254281,usda-ndb-import,chocolate covered pretzels,2092.0,22.5,5.0,0,,Meijer Milk Chocolate Covered Pretzels,7.5,40 g (40 g),0.25,40.0
Meijer  Inc.,meijer-inc,67.86,0.0,N713733903349,usda-ndb-import,yellow corn tortilla,2092.0,21.43,7.1,0,,Meijer  Inc. Organic Yellow Corn Tortilla Chips,7.14,28 g (13 CHIPS | ABOUT),0.41100000000000003,0.0
Meijer  Inc.,meijer-inc,8.16,0.0,N713733951760,usda-ndb-import,tomato basil soup,138.0,0.0,0.8,0,,Meijer  Inc. Organic Tomato Basil Soup,0.41,245 g (1 cup),0.22899999999999998,4.08
"Purple Cow,  Meijer  Inc.","purple-cow,meijer-inc",26.47,0.037000000000000005,N713733958301,usda-ndb-import,premium ice cream,925.0,11.76,0.0,0,,Purple Cow Premium Ice Cream,2.94,68 g (0.5 cup),0.051,22.06
Csm Bakery Products Na  Inc,csm-bakery-products-na-inc,55.42,0.036000000000000004,N715432003085,usda-ndb-import,red velvet cake,1615.0,16.87,1.2,0,,Csm Bakery Products Na  Inc Red Velvet Cake,3.61,83 g (0.1 CAKE),0.325,40.96
"Richin,  Richin Trading Inc.","richin,richin-trading-inc",2.58,0.061,N715685100326,usda-ndb-import,tomato sauce with,406.0,3.23,1.9,0,,Richin Sardines In Tomato Sauce With Chili,13.55,155 g (155 g),0.19399999999999998,2.58
"Richin,  Richin Trading Inc.","richin,richin-trading-inc",2.58,0.061,N715685100333,usda-ndb-import,sardines in tomato,406.0,3.23,1.9,0,,Richin Sardines In Tomato Sauce,13.55,155 g (155 g),0.19399999999999998,2.58
United Dairy,united-dairy,45.45,0.03,N71582217276,usda-ndb-import,premium ice cream,1013.0,10.61,0.0,0,,United Dairy Premium Ice Cream,3.03,66 g (0.5 cup),0.076,27.27
"Sunny Select,  Super Store Industries","sunny-select,super-store-industries",57.14,0.0,N717544130734,usda-ndb-import,chips salt vinegar,2243.0,32.14,3.6,0,,"Sunny Select Potato Chips, Salt & Vinegar",7.14,28 g (17 CHIPS),0.9640000000000001,7.14
Schwartz Brothers Bakery,schwartz-brothers-bakery,50.0,0.038,N717887170053,usda-ndb-import,cookies peanut butter,2092.0,26.92,0.0,0,,"Schwartz Brothers Bakery Cookies, Peanut Butter",7.69,26 g (1 COOKIE),0.34600000000000003,26.92
"Black Forest,  Gretchen's Shoebox Express","black-forest,gretchen-s-shoebox-express",16.67,0.035,N717887717081,usda-ndb-import,whole grain bread,803.0,6.57,2.5,0,,Black Forest Ham & Swiss On Whole Grain Bread,15.15,198 g (1 SANDWICH),0.596,0.0
Meijer,meijer,21.43,0.0,N719283165589,usda-ndb-import,dry roasted peanuts,2389.0,50.0,7.1,0,,Meijer Dry Roasted Peanuts,25.0,28 g (0.25 cup),0.196,3.57
Meijer  Inc.,meijer-inc,68.42,0.0,N719283238047,usda-ndb-import,greek style yogurt,1540.0,3.95,5.3,0,,Meijer  Inc. Instant Oatmeal With Greek Style Yogurt,18.42,38 g (1 PACKET),0.5,31.58
"Meijer,  Meijer  Inc.","meijer,meijer-inc",53.57,0.0,N719283409485,usda-ndb-import,classic potato chips,2243.0,32.14,3.6,0,,"Meijer Classic Potato Chips, Sour Cream & Onion",7.14,28 g (24 CHIPS),0.857,7.14
Meijer,meijer,60.71,0.0,N719283595577,usda-ndb-import,potato chips original,2243.0,32.14,3.6,0,,"Meijer Kettle Cooked Potato Chips, Original",7.14,28 g (1 oz),0.0,3.57
Meijer,meijer,67.86,0.0,N719283661234,usda-ndb-import,yellow corn tortilla,2092.0,21.43,7.1,0,,"Meijer True Goodness, Organic Yellow Corn Tortilla Chips",7.14,28 g (1 oz),0.41100000000000003,0.0
Meijer,meijer,71.43,0.006999999999999999,N719283985279,usda-ndb-import,macaroni cheese dinner,1552.0,3.57,2.9,0,,Meijer Dinosaur Macaroni & Cheese Dinner,12.86,70 g (2.5 oz),0.871,7.14
Harris Teeter,harris-teeter,43.75,0.023,N7203671376,usda-ndb-import,ice cream sandwich,1113.0,9.38,1.6,0,,Harris Teeter Ice Cream Sandwich,4.69,64 g (1 SANDWICH),0.23399999999999999,21.88
Golden Flake,golden-flake,50.75,0.0,N72080035804,usda-ndb-import,style potato chips,2125.0,33.83,5.6,0,,Golden Flake Dip Style Potato Chips,7.52,53.2 g (1 PKG),0.846,1.88
"Hebert,  Hebert Confections  Llc","hebert,hebert-confections-llc",51.61,0.0,N721605267680,usda-ndb-import,peanut butter cup,2159.0,35.48,3.2,0,,"Hebert Candies, Peanut Butter Cup Milk Chocolate Bar",9.68,31 g (31 GRM),0.161,45.16
Clif Bar And Company,clif-bar-and-company,52.08,0.0,N722252014221,usda-ndb-import,fruit nut bar,1657.0,25.0,10.4,0,,Clif Bar And Company Fruit + Nut Bar,8.33,48 g (1 BAR),0.21899999999999997,31.25
Luna,luna,46.67,0.011000000000000001,N722252234070,usda-ndb-import,high protein bar,1674.0,15.56,6.7,0,,Luna High Protein Bar,26.67,45 g (1 BAR),0.311,28.89
Clif,clif,60.29,0.0,N722252313218,usda-ndb-import,crunchy peanut butter,1598.0,10.29,5.9,0,,"Clif Energy Bar Made With Organic Peanut Butter, Crunchy Peanut Butter",16.18,68 g (68 g),0.33799999999999997,29.41
"Clif,  Clif Bar And Company","clif,clif-bar-and-company",44.44,0.0,N722252326348,usda-ndb-import,dark chocolate almonds,1954.0,26.67,6.7,0,,"Clif Mojo, Trail Mix Bar, Dark Chocolate Almonds Coconut",17.78,45 g (1 BAR),0.37799999999999995,22.22
Luna,luna,46.67,0.011000000000000001,N722252333063,usda-ndb-import,high protein bar,1582.0,10.0,6.7,0,,"Luna Protein, High Protein Bar, Lemon Vanilla",26.67,45 g (45 g),0.35600000000000004,33.33
Luna,luna,48.89,0.011000000000000001,N722252333087,usda-ndb-import,high protein bar,1582.0,11.11,6.7,0,,"Luna Protein, High Protein Bar, Chocolate Salted Caramel",26.67,45 g (45 g),0.6,33.33
Luna,luna,48.89,0.011000000000000001,N722252333094,usda-ndb-import,high protein bar,1582.0,11.11,6.7,0,,"Luna Protein, High Protein Bar, Berry Greek Yogurt",26.67,45 g (45 g),0.35600000000000004,33.33
Luna,luna,46.67,0.011000000000000001,N722252334039,usda-ndb-import,high protein bar,1582.0,13.33,6.7,0,,"Luna Protein, High Protein Bar, Chocolate Chip Cookie Dough",26.67,45 g (45 g),0.578,33.33
"Clif,  Clif Bar And Company","clif,clif-bar-and-company",56.52,0.0,N722252343239,usda-ndb-import,fruit nut bar,1636.0,19.57,8.7,0,,"Clif Kit's Organic, Fruit + Nut Bar, Dark Chocolate Walnut",6.52,46 g (1 BAR),0.207,45.65
Tuny,tuny,0.0,0.036000000000000004,N722596000201,usda-ndb-import,chunk white albacore,372.0,1.79,0.0,0,,Tuny Chunk White Albacore Tuna In Water,19.64,56 g (0.25 CUP) | DRAINED (ABOUT),0.25,0.0
"Jewel Osco,  Superior Nut/Candy Distribut'G","jewel-osco,superior-nut-candy-distribut-g",47.37,0.013000000000000001,N722648544097,usda-ndb-import,dark chocolate almonds,2201.0,39.47,7.9,0,,"Jewel Osco Dark Chocolate, Almonds",10.53,38 g (0.25 cup),0.013000000000000001,34.21
Superior Nut & Candy,superior-nut-candy,16.67,0.0,N722648715657,usda-ndb-import,roasted salted almonds,2556.0,55.56,11.1,0,,Superior Nut & Candy Roasted Salted Almonds,22.22,36 g (0.25 cup),0.33299999999999996,5.56
My Essentials,my-essentials,21.43,0.0,N725439107013,usda-ndb-import,dry roasted peanuts,2389.0,50.0,7.1,0,,My Essentials Unsalted Dry Roasted Peanuts,25.0,28 g (1 oz),0.0,3.57
My Essentials,my-essentials,0.0,0.0,N725439108980,usda-ndb-import,vegetable oil spread,1795.0,50.0,0.0,0,,My Essentials 48% Vegetable Oil Spread,0.0,14 g (1 Tbsp),0.75,0.0
"My Essentials,  Delhaize America  Inc.","my-essentials,delhaize-america-inc",0.0,0.0,N725439116046,usda-ndb-import,vegetable oil spread,1494.0,35.71,0.0,0,,My Essentials 39% Vegetable Oil Spread,0.0,14 g (1 Tbsp),0.679,0.0
"Cha-Ching,  Delhaize America  Inc.","cha-ching,delhaize-america-inc",20.0,0.017,N725439300360,usda-ndb-import,thousand island dressing,1117.0,20.0,0.0,0,,Cha-Ching Thousand Island Dressing,0.0,30 ml (2 Tbsp),1.0,16.67
"Cha-Ching,  Delhaize America  Inc.","cha-ching,delhaize-america-inc",21.88,0.0,N725439300841,usda-ndb-import,crunchy peanut butter,2615.0,50.0,6.2,0,,Cha-Ching Crunchy Peanut Butter,25.0,32 g (2 Tbsp),0.375,9.38
"Cha-Ching,  Delhaize America  Inc.","cha-ching,delhaize-america-inc",50.0,0.0,N725439300858,usda-ndb-import,potato chips original,2243.0,35.71,3.6,0,,"Cha-Ching Potato Chips, Original",7.14,28 g (16 CHIPS),0.5710000000000001,0.0
Taste Of Inspirations,taste-of-inspirations,14.29,0.0,N725439980906,usda-ndb-import,red pepper hummus,749.0,12.5,3.6,0,,Taste Of Inspirations All Natural Roasted Red Pepper Hummus,3.57,28 g (2 Tbsp),0.429,3.57
Taste Of Inspirations,taste-of-inspirations,76.0,0.0,N725439990004,usda-ndb-import,pancake waffle mix,1423.0,0.0,4.0,0,,Taste Of Inspirations Pancake & Waffle Mix,10.0,50 g (2 PANCAKES | MAKES),0.98,20.0
Terri Lynn  Inc.,terri-lynn-inc,16.67,0.0,N726338070156,usda-ndb-import,roasted salted almonds,2510.0,56.67,10.0,0,,"Terri Lynn  Inc. Terri Lynn, Roasted & Salted Almonds, Roasted & Salted",20.0,30 g (0.25 cup),0.33299999999999996,3.33
Haggen,haggen,68.85,0.025,N726984022011,usda-ndb-import,pancake waffle mix,1510.0,4.1,1.6,0,,"Haggen Pancake & Waffle Mix, Butter Milk",9.84,61 g (0.5 cup),1.0,14.75
Haggen,haggen,7.32,0.012,N726984370068,usda-ndb-import,chicken noodle soup,205.0,1.22,0.8,0,,Haggen Condensed Chicken Noodle Soup,2.44,123 g (0.5 cup),0.732,0.0
"Terra,  The Hain Celestial Group  Inc.","terra,the-hain-celestial-group-inc",57.14,0.0,N728229014751,usda-ndb-import,sweet potato chips,2243.0,32.14,10.7,0,,"Terra Sweet Potato Chips, Pumpkin Spice Sweets",3.57,28 g (15 CHIPS),0.5710000000000001,14.29
Terra,terra,64.29,0.0,N728229678939,usda-ndb-import,potato chips original,1941.0,21.43,3.6,0,,"Terra Yukon Gold, Potato Chips, Original",7.14,28 g (1 oz),0.28600000000000003,3.57
Country Choice,country-choice,67.5,0.0,N729906510023,usda-ndb-import,steel cut oats,1569.0,7.5,10.0,0,,Country Choice Steel Cut Oats,12.5,40 g (0.25 cup),0.0,2.5
Savory Foods Inc.,savory-foods-inc,57.69,0.0,N733549028982,usda-ndb-import,dark chocolate bar,2251.0,34.62,7.7,0,,"Savory Foods Inc. Mac Chocolate Bar, Dark Chocolate Bar",3.85,26 g (26 g),0.0,50.0
Sonoma Gourmet,sonoma-gourmet,4.0,0.0,N733636330042,usda-ndb-import,organic pasta sauce,268.0,4.8,0.8,0,,Sonoma Gourmet Organic Pasta Sauce,0.8,125 g (0.5 cup),0.22399999999999998,3.2
Stroh's,stroh-s,25.35,0.042,N738248000079,usda-ndb-import,premium ice cream,824.0,11.27,1.4,0,,"Stroh's Premium Ice Cream, Chocolate",2.82,71 g (0.5 cup),0.063,16.9
Wegmans,wegmans,3.57,0.071,N740247017347,usda-ndb-import,whipped cream cheese,895.0,17.86,0.0,0,,Wegmans Reduced Fat Plain Whipped Cream Cheese,7.14,28 g (2 Tbsp),0.5710000000000001,0.0
Lowes Foods,lowes-foods,8.0,0.0,N741643021198,usda-ndb-import,mushroom condensed soup,335.0,4.8,1.6,0,,Lowes Foods Cream Of Mushroom Condensed Soup,1.6,125 g (0.5 cup),0.64,0.8
Lowes Foods,lowes-foods,79.17,0.0,N741643036130,usda-ndb-import,chewy granola bars,1745.0,10.42,4.2,0,,Lowes Foods Chewy Granola Bars,4.17,24 g (1 BAR),0.20800000000000002,29.17
Noga,noga,12.67,0.006999999999999999,N742906125028,usda-ndb-import,fat greek yogurt,335.0,0.0,0.0,0,,"Noga 0% Fat Greek Yogurt, Blueberry",7.33,150 g (5.3 oz),0.033,11.33
So Delicious Dairy Free,so-delicious-dairy-free,26.58,0.0,N744473000265,usda-ndb-import,dairy frozen dessert,795.0,8.86,1.3,0,,"So Delicious Dairy Free Cashewmilk Non-Dairy Frozen Dessert, Very Vanilla",2.53,79 g (0.5 cup),0.12,22.78
So Delicious Dairy Free,so-delicious-dairy-free,25.61,0.0,N744473000272,usda-ndb-import,dairy frozen dessert,766.0,8.54,2.4,0,,"So Delicious Dairy Free Cashew Milk Non-Dairy Frozen Dessert, Creamy Chocolate",3.66,82 g (0.5 cup),0.128,19.51
So Delicious Dairy Free,so-delicious-dairy-free,24.71,0.0,N744473470211,usda-ndb-import,dairy frozen dessert,690.0,8.24,8.2,0,,"So Delicious Dairy Free Coconut Milk Non-Dairy Frozen Dessert, Chocolate",1.18,85 g (0.5 cup),0.018000000000000002,16.47
"So Delicious Dairy Free,  Turtle Mountain  Llc","so-delicious-dairy-free,turtle-mountain-llc",25.0,0.0,N744473472154,usda-ndb-import,dairy frozen dessert,598.0,6.25,8.9,0,,"So Delicious Dairy Free Minis Coconut Milk Non-Dairy Frozen Dessert, Fudge Bar",1.79,56 g (56 g),0.027000000000000003,17.86
So Delicious Dairy Free,so-delicious-dairy-free,29.41,0.0,N744473474110,usda-ndb-import,dairy frozen dessert,1151.0,19.61,7.8,0,,"So Delicious Dairy Free Minis Coconut Milk Non-Dairy Frozen Dessert, Vanilla",1.96,51 g (51 g),0.01,21.57
"So Delicious Dairy Free,  So Delicious","so-delicious-dairy-free,so-delicious",28.24,0.0,N744473476213,usda-ndb-import,dairy frozen dessert,887.0,10.59,2.4,0,,"So Delicious Dairy Free Cashew Milk Non-Dairy Frozen Dessert, Dark Chocolate Truffle",3.53,85 g (0.5 cup),0.141,21.18
Equal Exchange  Inc.,equal-exchange-inc,50.0,0.0,N745998244073,usda-ndb-import,fruit nut bar,1674.0,20.0,5.0,0,,"Equal Exchange  Inc. Equal Exchange, Organic Fruit & Nut Bar, Apricot Cashew",10.0,40 g (1 BAR),0.0,35.0
Jimmy's Cookies  Llc,jimmy-s-cookies-llc,53.57,0.0,N747366018231,usda-ndb-import,chocolate chunk cookies,1941.0,28.57,3.6,0,,"Jimmy's Cookies  Llc One Smart Cookie, Peanut Butter Chocolate Chunk Cookies",7.14,28 g (1 COOKIE),0.33899999999999997,35.71
Rao's Homemade,rao-s-homemade,3.54,0.0,N747479000703,usda-ndb-import,tomato sauce with,297.0,5.31,1.8,0,,Rao's Homemade Tomato Sauce With Artichoke,1.77,113 g (0.5 cup),0.28300000000000003,2.65
Rje Trade International  Inc.,rje-trade-international-inc,28.57,0.0,N748252520623,usda-ndb-import,honey roasted peanuts,2389.0,42.86,7.1,0,,"Rje Trade International  Inc. Gillespie's Peanuts, Honey Roasted Peanuts",21.43,28 g (1 ONZ),0.429,17.86
Columbus Seafoods Corporation,columbus-seafoods-corporation,3.57,0.0,N748485200026,usda-ndb-import,sardines in tomato,372.0,3.57,0.0,0,,"Columbus Seafoods Corporation 555, Sardines In Tomato Sauce, Hot",10.71,56 g (56 g),0.643,1.79
Rexall Sundown  Inc.,rexall-sundown-inc,41.51,0.009000000000000001,N749826575551,usda-ndb-import,fruit nut bar,1577.0,8.49,9.4,0,,"Rexall Sundown  Inc. Pure Protein, Fruit & Nut Bar",33.96,53 g (1 BAR),0.302,16.98
"Star,  Star Snacks","star,star-snacks",50.0,0.0,N753519469461,usda-ndb-import,honey roasted peanuts,2092.0,32.14,3.6,0,,"Star Snacks, Honey Roasted Peanuts",14.29,28 g (1 oz),0.125,39.29
Thinkthin  Llc,thinkthin-llc,40.0,0.0,N753656711997,usda-ndb-import,high protein bar,1745.0,15.0,1.7,0,,Thinkthin  Llc High Protein Bar,33.33,60 g (1 BAR),0.38299999999999995,0.0
Hy-Vee  Inc.,hy-vee-inc,0.0,0.0,N75450085200,usda-ndb-import,vegetable oil spread,2092.0,57.14,0.0,0,,Hy-Vee  Inc. Vegetable Oil Spread,0.0,14 g (1 Tbsp),0.643,0.0
Good Health Natural Products Inc.,good-health-natural-products-inc,64.29,0.0,N755355008194,usda-ndb-import,style potato chips,2092.0,25.0,3.6,0,,"Good Health Natural Products Inc. Enjoy Being Good, Sea Salt Avocado Oil Kettle Style Potato Chips",7.14,28 g (1 BAG),0.161,0.0
